No.     Time           Source                Destination           Protocol Length Info
      1 0.000000000    Cisco_3a:fa:83        Spanning-tree-(for-bridges)_00 STP      60     Conf. Root = 32768/30/fc:fb:fb:3a:fa:80  Cost = 0  Port = 0x8003
      2 1.068730928    Cisco_3a:fa:83        Cisco_3a:fa:83        LOOP     60     Reply
      3 1.999884708    Cisco_3a:fa:83        Spanning-tree-(for-bridges)_00 STP      60     Conf. Root = 32768/30/fc:fb:fb:3a:fa:80  Cost = 0  Port = 0x8003
      4 4.004686265    Cisco_3a:fa:83        Spanning-tree-(for-bridges)_00 STP      60     Conf. Root = 32768/30/fc:fb:fb:3a:fa:80  Cost = 0  Port = 0x8003
      5 6.014662807    Cisco_3a:fa:83        Spanning-tree-(for-bridges)_00 STP      60     Conf. Root = 32768/30/fc:fb:fb:3a:fa:80  Cost = 0  Port = 0x8003
      6 8.014460702    Cisco_3a:fa:83        Spanning-tree-(for-bridges)_00 STP      60     Conf. Root = 32768/30/fc:fb:fb:3a:fa:80  Cost = 0  Port = 0x8003
      7 10.019415911   Cisco_3a:fa:83        Spanning-tree-(for-bridges)_00 STP      60     Conf. Root = 32768/30/fc:fb:fb:3a:fa:80  Cost = 0  Port = 0x8003
      8 11.076377200   Cisco_3a:fa:83        Cisco_3a:fa:83        LOOP     60     Reply
      9 12.029213448   Cisco_3a:fa:83        Spanning-tree-(for-bridges)_00 STP      60     Conf. Root = 32768/30/fc:fb:fb:3a:fa:80  Cost = 0  Port = 0x8003
     10 13.803197910   Cisco_3a:fa:83        CDP/VTP/DTP/PAgP/UDLD CDP      435    Device ID: tux-sw3  Port ID: FastEthernet0/1  
     11 14.029115896   Cisco_3a:fa:83        Spanning-tree-(for-bridges)_00 STP      60     Conf. Root = 32768/30/fc:fb:fb:3a:fa:80  Cost = 0  Port = 0x8003
     12 16.034001333   Cisco_3a:fa:83        Spanning-tree-(for-bridges)_00 STP      60     Conf. Root = 32768/30/fc:fb:fb:3a:fa:80  Cost = 0  Port = 0x8003
     13 18.043874090   Cisco_3a:fa:83        Spanning-tree-(for-bridges)_00 STP      60     Conf. Root = 32768/30/fc:fb:fb:3a:fa:80  Cost = 0  Port = 0x8003
     14 19.588223735   172.16.30.1           172.16.1.1            DNS      76     Standard query 0xaeb6 A netlab1.fe.up.pt
     15 19.609195914   172.16.1.1            172.16.30.1           DNS      340    Standard query response 0xaeb6 A netlab1.fe.up.pt A 192.168.109.136 NS ns3.up.pt NS ns4.up.pt NS ns1.up.pt NS ns2.up.pt A 193.137.55.30 AAAA 2001:690:2200:a10::30 A 193.137.55.31 AAAA 2001:690:2200:a10::31 A 193.137.55.32 AAAA 2001:690:2200:a10::32 A 193.137.55.33 AAAA 2001:690:2200:a10::33
     16 19.609265196   172.16.30.1           192.168.109.136       TCP      74     46984 > 21 [SYN] Seq=0 Win=64240 Len=0 MSS=1460 SACK_PERM=1 TSval=1802215218 TSecr=0 WS=128
     17 19.629166913   192.168.109.136       172.16.30.1           TCP      74     21 > 46984 [SYN, ACK] Seq=0 Ack=1 Win=65160 Len=0 MSS=1460 SACK_PERM=1 TSval=3786451737 TSecr=1802215218 WS=128
     18 19.629186189   172.16.30.1           192.168.109.136       TCP      66     46984 > 21 [ACK] Seq=1 Ack=1 Win=64256 Len=0 TSval=1802215238 TSecr=3786451737
     19 19.651328913   192.168.109.136       172.16.30.1           FTP      100    Response: 220 Welcome to netlab-FTP server
     20 19.651341485   172.16.30.1           192.168.109.136       TCP      66     46984 > 21 [ACK] Seq=1 Ack=35 Win=64256 Len=0 TSval=1802215260 TSecr=3786451758
     21 19.651366697   172.16.30.1           192.168.109.136       FTP      71     Request: user 
     22 19.672365555   192.168.109.136       172.16.30.1           TCP      66     21 > 46984 [ACK] Seq=35 Ack=6 Win=65280 Len=0 TSval=3786451779 TSecr=1802215260
     23 19.672373727   172.16.30.1           192.168.109.136       FTP      71     Request: rcom
     24 19.692324751   192.168.109.136       172.16.30.1           TCP      66     21 > 46984 [ACK] Seq=35 Ack=11 Win=65280 Len=0 TSval=3786451799 TSecr=1802215281
     25 19.692329570   192.168.109.136       172.16.30.1           FTP      100    Response: 331 Please specify the password.
     26 19.692354294   172.16.30.1           192.168.109.136       FTP      71     Request: pass 
     27 19.712256290   192.168.109.136       172.16.30.1           TCP      66     21 > 46984 [ACK] Seq=69 Ack=16 Win=65280 Len=0 TSval=3786451819 TSecr=1802215301
     28 19.712263833   172.16.30.1           192.168.109.136       FTP      71     Request: rcom
     29 19.732196210   192.168.109.136       172.16.30.1           TCP      66     21 > 46984 [ACK] Seq=69 Ack=21 Win=65280 Len=0 TSval=3786451839 TSecr=1802215321
     30 19.742051839   192.168.109.136       172.16.30.1           FTP      89     Response: 230 Login successful.
     31 19.742071534   172.16.30.1           192.168.109.136       FTP      71     Request: pasv
     32 19.763095535   192.168.109.136       172.16.30.1           TCP      66     21 > 46984 [ACK] Seq=92 Ack=26 Win=65280 Len=0 TSval=3786451869 TSecr=1802215351
     33 19.763118094   192.168.109.136       172.16.30.1           FTP      120    Response: 227 Entering Passive Mode (192,168,109,136,168,169).
     34 19.763156577   172.16.30.1           192.168.109.136       TCP      74     40546 > 43177 [SYN] Seq=0 Win=64240 Len=0 MSS=1460 SACK_PERM=1 TSval=1802215372 TSecr=0 WS=128
     35 19.783171506   192.168.109.136       172.16.30.1           TCP      74     43177 > 40546 [SYN, ACK] Seq=0 Ack=1 Win=65160 Len=0 MSS=1460 SACK_PERM=1 TSval=3786451890 TSecr=1802215372 WS=128
     36 19.783184916   172.16.30.1           192.168.109.136       TCP      66     40546 > 43177 [ACK] Seq=1 Ack=1 Win=64256 Len=0 TSval=1802215392 TSecr=3786451890
     37 19.783204332   172.16.30.1           192.168.109.136       FTP      71     Request: retr 
     38 19.847408747   192.168.109.136       172.16.30.1           TCP      66     21 > 46984 [ACK] Seq=146 Ack=31 Win=65280 Len=0 TSval=3786451953 TSecr=1802215392
     39 19.847416918   172.16.30.1           192.168.109.136       FTP      81     Request: files/crab.mp4
     40 19.868951043   192.168.109.136       172.16.30.1           FTP-DATA 1514   FTP Data: 1448 bytes (PASV) (retr )
     41 19.868959214   172.16.30.1           192.168.109.136       TCP      66     40546 > 43177 [ACK] Seq=1 Ack=1449 Win=64128 Len=0 TSval=1802215478 TSecr=3786451975
     42 19.869071799   192.168.109.136       172.16.30.1           FTP-DATA 1514   FTP Data: 1448 bytes (PASV) (retr )
     43 19.869079272   172.16.30.1           192.168.109.136       TCP      66     40546 > 43177 [ACK] Seq=1 Ack=2897 Win=63488 Len=0 TSval=1802215478 TSecr=3786451975
     44 19.869195558   192.168.109.136       172.16.30.1           FTP-DATA 1514   FTP Data: 1448 bytes (PASV) (retr )
     45 19.869201425   172.16.30.1           192.168.109.136       TCP      66     40546 > 43177 [ACK] Seq=1 Ack=4345 Win=62464 Len=0 TSval=1802215478 TSecr=3786451975
     46 19.869317990   192.168.109.136       172.16.30.1           FTP-DATA 1514   FTP Data: 1448 bytes (PASV) (retr )
     47 19.869323997   172.16.30.1           192.168.109.136       TCP      66     40546 > 43177 [ACK] Seq=1 Ack=5793 Win=61440 Len=0 TSval=1802215478 TSecr=3786451975
     48 19.870547273   192.168.109.136       172.16.30.1           FTP-DATA 1514   FTP Data: 1448 bytes (PASV) (retr )
     49 19.870552860   172.16.30.1           192.168.109.136       TCP      66     40546 > 43177 [ACK] Seq=1 Ack=7241 Win=60544 Len=0 TSval=1802215480 TSecr=3786451975
     50 19.870670054   192.168.109.136       172.16.30.1           FTP-DATA 1514   FTP Data: 1448 bytes (PASV) (retr )
     51 19.870676130   172.16.30.1           192.168.109.136       TCP      66     40546 > 43177 [ACK] Seq=1 Ack=8689 Win=59520 Len=0 TSval=1802215480 TSecr=3786451975
     52 19.870793883   192.168.109.136       172.16.30.1           FTP-DATA 1514   FTP Data: 1448 bytes (PASV) (retr )
     53 19.870799401   172.16.30.1           192.168.109.136       TCP      66     40546 > 43177 [ACK] Seq=1 Ack=10137 Win=58496 Len=0 TSval=1802215480 TSecr=3786451975
     54 19.870916525   192.168.109.136       172.16.30.1           FTP-DATA 1514   [TCP Previous segment not captured] FTP Data: 1448 bytes (PASV) (retr )
     55 19.870922741   172.16.30.1           192.168.109.136       TCP      78     [TCP Dup ACK 53#1] 40546 > 43177 [ACK] Seq=1 Ack=10137 Win=58496 Len=0 TSval=1802215480 TSecr=3786451975 SLE=11585 SRE=13033
     56 19.890606342   192.168.109.136       172.16.30.1           FTP-DATA 1514   [TCP Previous segment not captured] FTP Data: 1448 bytes (PASV) (retr )
     57 19.890614444   172.16.30.1           192.168.109.136       TCP      86     [TCP Dup ACK 53#2] 40546 > 43177 [ACK] Seq=1 Ack=10137 Win=58496 Len=0 TSval=1802215500 TSecr=3786451975 SLE=14481 SRE=15929 SLE=11585 SRE=13033
     58 19.890726330   192.168.109.136       172.16.30.1           FTP-DATA 1514   FTP Data: 1448 bytes (PASV) (retr )
     59 19.890732825   172.16.30.1           192.168.109.136       TCP      86     [TCP Dup ACK 53#3] 40546 > 43177 [ACK] Seq=1 Ack=10137 Win=58496 Len=0 TSval=1802215500 TSecr=3786451975 SLE=14481 SRE=17377 SLE=11585 SRE=13033
     60 19.890848692   192.168.109.136       172.16.30.1           FTP-DATA 1514   FTP Data: 1448 bytes (PASV) (retr )
     61 19.890854839   172.16.30.1           192.168.109.136       TCP      86     [TCP Dup ACK 53#4] 40546 > 43177 [ACK] Seq=1 Ack=10137 Win=58496 Len=0 TSval=1802215500 TSecr=3786451975 SLE=14481 SRE=18825 SLE=11585 SRE=13033
     62 19.891834926   192.168.109.136       172.16.30.1           FTP-DATA 1514   FTP Data: 1448 bytes (PASV) (retr )
     63 19.891841002   172.16.30.1           192.168.109.136       TCP      86     [TCP Dup ACK 53#5] 40546 > 43177 [ACK] Seq=1 Ack=10137 Win=58496 Len=0 TSval=1802215501 TSecr=3786451975 SLE=14481 SRE=20273 SLE=11585 SRE=13033
     64 19.891957288   192.168.109.136       172.16.30.1           FTP-DATA 1514   FTP Data: 1448 bytes (PASV) (retr )
     65 19.891963365   172.16.30.1           192.168.109.136       TCP      86     [TCP Dup ACK 53#6] 40546 > 43177 [ACK] Seq=1 Ack=10137 Win=58496 Len=0 TSval=1802215501 TSecr=3786451975 SLE=14481 SRE=21721 SLE=11585 SRE=13033
     66 19.892817737   192.168.109.136       172.16.30.1           FTP-DATA 1514   FTP Data: 1448 bytes (PASV) (retr )
     67 19.892823743   172.16.30.1           192.168.109.136       TCP      86     [TCP Dup ACK 53#7] 40546 > 43177 [ACK] Seq=1 Ack=10137 Win=58496 Len=0 TSval=1802215502 TSecr=3786451975 SLE=14481 SRE=23169 SLE=11585 SRE=13033
     68 19.892940519   192.168.109.136       172.16.30.1           FTP-DATA 1514   FTP Data: 1448 bytes (PASV) (retr )
     69 19.892946595   172.16.30.1           192.168.109.136       TCP      86     [TCP Dup ACK 53#8] 40546 > 43177 [ACK] Seq=1 Ack=10137 Win=58496 Len=0 TSval=1802215502 TSecr=3786451975 SLE=14481 SRE=24617 SLE=11585 SRE=13033
     70 19.906231447   192.168.109.136       172.16.30.1           FTP-DATA 1514   [TCP Fast Retransmission] FTP Data: 1448 bytes (PASV) (retr )
     71 19.906238291   172.16.30.1           192.168.109.136       TCP      78     40546 > 43177 [ACK] Seq=1 Ack=13033 Win=55680 Len=0 TSval=1802215515 TSecr=3786452017 SLE=14481 SRE=24617
     72 19.906598325   192.168.109.136       172.16.30.1           TCP      1514   [TCP Out-Of-Order] 43177 > 40546 [ACK] Seq=13033 Ack=1 Win=65280 Len=1448 TSval=3786452018 TSecr=1802215500
     73 19.906604960   172.16.30.1           192.168.109.136       TCP      66     40546 > 43177 [ACK] Seq=1 Ack=24617 Win=48640 Len=0 TSval=1802215516 TSecr=3786452018
     74 19.906842840   192.168.109.136       172.16.30.1           FTP-DATA 1514   FTP Data: 1448 bytes (PASV) (retr )
     75 19.907705105   192.168.109.136       172.16.30.1           FTP-DATA 1514   FTP Data: 1448 bytes (PASV) (retr )
     76 19.907950528   192.168.109.136       172.16.30.1           FTP-DATA 1514   FTP Data: 1448 bytes (PASV) (retr )
     77 19.908690011   192.168.109.136       172.16.30.1           FTP-DATA 1514   FTP Data: 1448 bytes (PASV) (retr )
     78 19.908935295   192.168.109.136       172.16.30.1           FTP-DATA 1514   FTP Data: 1448 bytes (PASV) (retr )
     79 19.921979264   192.168.109.136       172.16.30.1           FTP-DATA 1514   FTP Data: 1448 bytes (PASV) (retr )
     80 19.947413553   172.16.30.1           192.168.109.136       TCP      66     40546 > 43177 [ACK] Seq=1 Ack=33305 Win=42496 Len=0 TSval=1802215556 TSecr=3786452018
     81 19.962587411   192.168.109.136       172.16.30.1           FTP-DATA 1514   FTP Data: 1448 bytes (PASV) (retr )
     82 19.962707539   192.168.109.136       172.16.30.1           FTP-DATA 1514   FTP Data: 1448 bytes (PASV) (retr )
     83 19.962830460   192.168.109.136       172.16.30.1           FTP-DATA 1514   FTP Data: 1448 bytes (PASV) (retr )
     84 19.962953032   192.168.109.136       172.16.30.1           FTP-DATA 1514   FTP Data: 1448 bytes (PASV) (retr )
     85 19.963075883   192.168.109.136       172.16.30.1           FTP-DATA 1514   FTP Data: 1448 bytes (PASV) (retr )
     86 19.963199573   192.168.109.136       172.16.30.1           FTP-DATA 1514   FTP Data: 1448 bytes (PASV) (retr )
     87 19.963322145   192.168.109.136       172.16.30.1           FTP-DATA 1514   FTP Data: 1448 bytes (PASV) (retr )
     88 19.964551287   192.168.109.136       172.16.30.1           FTP-DATA 1514   FTP Data: 1448 bytes (PASV) (retr )
     89 20.003413325   172.16.30.1           192.168.109.136       TCP      66     40546 > 43177 [ACK] Seq=1 Ack=44889 Win=34560 Len=0 TSval=1802215612 TSecr=3786452074
     90 20.018936251   192.168.109.136       172.16.30.1           FTP-DATA 1514   FTP Data: 1448 bytes (PASV) (retr )
     91 20.019059103   192.168.109.136       172.16.30.1           FTP-DATA 1514   FTP Data: 1448 bytes (PASV) (retr )
     92 20.019182303   192.168.109.136       172.16.30.1           FTP-DATA 1514   FTP Data: 1448 bytes (PASV) (retr )
     93 20.019304456   192.168.109.136       172.16.30.1           FTP-DATA 1514   FTP Data: 1448 bytes (PASV) (retr )
     94 20.019428984   192.168.109.136       172.16.30.1           FTP-DATA 1514   FTP Data: 1448 bytes (PASV) (retr )
     95 20.019550858   192.168.109.136       172.16.30.1           FTP-DATA 1514   FTP Data: 1448 bytes (PASV) (retr )
     96 20.019673849   192.168.109.136       172.16.30.1           FTP-DATA 1514   FTP Data: 1448 bytes (PASV) (retr )
     97 20.019797608   192.168.109.136       172.16.30.1           FTP-DATA 1514   FTP Data: 1448 bytes (PASV) (retr )
     98 20.043900786   Cisco_3a:fa:83        Spanning-tree-(for-bridges)_00 STP      60     Conf. Root = 32768/30/fc:fb:fb:3a:fa:80  Cost = 0  Port = 0x8003
     99 20.059414424   172.16.30.1           192.168.109.136       TCP      66     40546 > 43177 [ACK] Seq=1 Ack=56473 Win=26368 Len=0 TSval=1802215668 TSecr=3786452130
    100 20.075166082   192.168.109.136       172.16.30.1           FTP-DATA 1514   FTP Data: 1448 bytes (PASV) (retr )
    101 20.075288793   192.168.109.136       172.16.30.1           FTP-DATA 1514   FTP Data: 1448 bytes (PASV) (retr )
    102 20.075416953   172.16.30.1           192.168.109.136       TCP      81     [TCP Retransmission] 46984 > 21 [PSH, ACK] Seq=31 Ack=146 Win=64256 Len=15 TSval=1802215684 TSecr=3786451953
    103 20.075423727   192.168.109.136       172.16.30.1           FTP-DATA 1514   FTP Data: 1448 bytes (PASV) (retr )
    104 20.075534147   192.168.109.136       172.16.30.1           FTP-DATA 1514   FTP Data: 1448 bytes (PASV) (retr )
    105 20.075778872   192.168.109.136       172.16.30.1           FTP-DATA 1514   FTP Data: 1448 bytes (PASV) (retr )
    106 20.075902492   192.168.109.136       172.16.30.1           FTP-DATA 1514   FTP Data: 1448 bytes (PASV) (retr )
    107 20.076026600   192.168.109.136       172.16.30.1           FTP-DATA 1514   FTP Data: 1448 bytes (PASV) (retr )
    108 20.076150010   192.168.109.136       172.16.30.1           FTP-DATA 1514   FTP Data: 1448 bytes (PASV) (retr )
    109 20.090199488   192.168.109.136       172.16.30.1           FTP      144    Response: 150 Opening BINARY mode data connection for files/crab.mp4 (88123184 bytes).
    110 20.091295792   192.168.109.136       172.16.30.1           TCP      78     [TCP Dup ACK 109#1] 21 > 46984 [ACK] Seq=224 Ack=46 Win=65280 Len=0 TSval=3786452202 TSecr=1802215684 SLE=31 SRE=46
    111 20.109613082   172.16.30.1           192.168.109.136       TCP      66     40546 > 43177 [ACK] Seq=1 Ack=68057 Win=18432 Len=0 TSval=1802215719 TSecr=3786452186
    112 20.109936448   172.16.30.1           192.168.109.136       TCP      66     [TCP Window Update] 40546 > 43177 [ACK] Seq=1 Ack=68057 Win=54528 Len=0 TSval=1802215719 TSecr=3786452186
    113 20.125029639   192.168.109.136       172.16.30.1           FTP-DATA 1514   FTP Data: 1448 bytes (PASV) (retr )
    114 20.125143621   192.168.109.136       172.16.30.1           FTP-DATA 1514   FTP Data: 1448 bytes (PASV) (retr )
    115 20.125163316   172.16.30.1           192.168.109.136       TCP      66     40546 > 43177 [ACK] Seq=1 Ack=70953 Win=64128 Len=0 TSval=1802215734 TSecr=3786452236
    116 20.125255088   192.168.109.136       172.16.30.1           FTP-DATA 1514   FTP Data: 1448 bytes (PASV) (retr )
    117 20.125389394   192.168.109.136       172.16.30.1           FTP-DATA 1514   FTP Data: 1448 bytes (PASV) (retr )
    118 20.125395330   172.16.30.1           192.168.109.136       TCP      66     40546 > 43177 [ACK] Seq=1 Ack=73849 Win=64128 Len=0 TSval=1802215734 TSecr=3786452236
    119 20.125511407   192.168.109.136       172.16.30.1           FTP-DATA 1514   FTP Data: 1448 bytes (PASV) (retr )
    120 20.126742226   192.168.109.136       172.16.30.1           FTP-DATA 1514   FTP Data: 1448 bytes (PASV) (retr )
    121 20.126749978   172.16.30.1           192.168.109.136       TCP      66     40546 > 43177 [ACK] Seq=1 Ack=76745 Win=64128 Len=0 TSval=1802215736 TSecr=3786452236
    122 20.126864728   192.168.109.136       172.16.30.1           FTP-DATA 1514   FTP Data: 1448 bytes (PASV) (retr )
    123 20.126988557   192.168.109.136       172.16.30.1           FTP-DATA 1514   FTP Data: 1448 bytes (PASV) (retr )
    124 20.126995192   172.16.30.1           192.168.109.136       TCP      66     40546 > 43177 [ACK] Seq=1 Ack=79641 Win=64128 Len=0 TSval=1802215736 TSecr=3786452237
    125 20.127113085   192.168.109.136       172.16.30.1           FTP-DATA 1514   FTP Data: 1448 bytes (PASV) (retr )
    126 20.127234888   192.168.109.136       172.16.30.1           FTP-DATA 1514   FTP Data: 1448 bytes (PASV) (retr )
    127 20.127241523   172.16.30.1           192.168.109.136       TCP      66     40546 > 43177 [ACK] Seq=1 Ack=82537 Win=64128 Len=0 TSval=1802215736 TSecr=3786452237
    128 20.131420706   172.16.30.1           192.168.109.136       TCP      66     46984 > 21 [ACK] Seq=46 Ack=224 Win=64256 Len=0 TSval=1802215740 TSecr=3786452201
    129 20.141760128   192.168.109.136       172.16.30.1           FTP-DATA 1514   FTP Data: 1448 bytes (PASV) (retr )
    130 20.141877601   192.168.109.136       172.16.30.1           FTP-DATA 1514   FTP Data: 1448 bytes (PASV) (retr )
    131 20.141891011   172.16.30.1           192.168.109.136       TCP      66     40546 > 43177 [ACK] Seq=1 Ack=85433 Win=64128 Len=0 TSval=1802215751 TSecr=3786452252
    132 20.141999265   192.168.109.136       172.16.30.1           FTP-DATA 1514   FTP Data: 1448 bytes (PASV) (retr )
    133 20.142123583   192.168.109.136       172.16.30.1           FTP-DATA 1514   FTP Data: 1448 bytes (PASV) (retr )
    134 20.142131406   172.16.30.1           192.168.109.136       TCP      66     40546 > 43177 [ACK] Seq=1 Ack=88329 Win=64128 Len=0 TSval=1802215751 TSecr=3786452252
    135 20.142736304   192.168.109.136       172.16.30.1           FTP-DATA 1514   FTP Data: 1448 bytes (PASV) (retr )
    136 20.142743707   172.16.30.1           192.168.109.136       TCP      66     40546 > 43177 [ACK] Seq=1 Ack=89777 Win=67072 Len=0 TSval=1802215752 TSecr=3786452254
    137 20.142860203   192.168.109.136       172.16.30.1           FTP-DATA 1514   FTP Data: 1448 bytes (PASV) (retr )
    138 20.142868304   172.16.30.1           192.168.109.136       TCP      66     40546 > 43177 [ACK] Seq=1 Ack=91225 Win=69888 Len=0 TSval=1802215752 TSecr=3786452254
    139 20.142987035   192.168.109.136       172.16.30.1           FTP-DATA 1514   FTP Data: 1448 bytes (PASV) (retr )
    140 20.142994229   172.16.30.1           192.168.109.136       TCP      66     40546 > 43177 [ACK] Seq=1 Ack=92673 Win=72832 Len=0 TSval=1802215752 TSecr=3786452254
    141 20.144093675   192.168.109.136       172.16.30.1           FTP-DATA 1514   FTP Data: 1448 bytes (PASV) (retr )
    142 20.144100241   172.16.30.1           192.168.109.136       TCP      66     40546 > 43177 [ACK] Seq=1 Ack=94121 Win=75776 Len=0 TSval=1802215753 TSecr=3786452254
    143 20.144217505   192.168.109.136       172.16.30.1           FTP-DATA 1514   FTP Data: 1448 bytes (PASV) (retr )
    144 20.144223721   172.16.30.1           192.168.109.136       TCP      66     40546 > 43177 [ACK] Seq=1 Ack=95569 Win=78592 Len=0 TSval=1802215753 TSecr=3786452254
    145 20.144339658   192.168.109.136       172.16.30.1           FTP-DATA 1514   FTP Data: 1448 bytes (PASV) (retr )
    146 20.144346223   172.16.30.1           192.168.109.136       TCP      66     40546 > 43177 [ACK] Seq=1 Ack=97017 Win=81536 Len=0 TSval=1802215753 TSecr=3786452254
    147 20.158486705   192.168.109.136       172.16.30.1           FTP-DATA 1514   FTP Data: 1448 bytes (PASV) (retr )
    148 20.158493339   172.16.30.1           192.168.109.136       TCP      66     40546 > 43177 [ACK] Seq=1 Ack=98465 Win=84480 Len=0 TSval=1802215767 TSecr=3786452269
    149 20.158609277   192.168.109.136       172.16.30.1           FTP-DATA 1514   FTP Data: 1448 bytes (PASV) (retr )
    150 20.158616331   172.16.30.1           192.168.109.136       TCP      66     40546 > 43177 [ACK] Seq=1 Ack=99913 Win=87296 Len=0 TSval=1802215768 TSecr=3786452269
...
   1600 20.910152573   172.16.30.1           192.168.109.136       TCP      66     40546 > 43177 [ACK] Seq=1 Ack=1151161 Win=2189824 Len=0 TSval=1802216519 TSecr=3786453015
   1601 20.910270535   192.168.109.136       172.16.30.1           FTP-DATA 1514   FTP Data: 1448 bytes (PASV) (retr )
   1602 20.910276402   172.16.30.1           192.168.109.136       TCP      66     40546 > 43177 [ACK] Seq=1 Ack=1152609 Win=2192768 Len=0 TSval=1802216519 TSecr=3786453015
   1603 20.910393457   192.168.109.136       172.16.30.1           FTP-DATA 1514   FTP Data: 1448 bytes (PASV) (retr )
   1604 20.910399393   172.16.30.1           192.168.109.136       TCP      66     40546 > 43177 [ACK] Seq=1 Ack=1154057 Win=2195584 Len=0 TSval=1802216519 TSecr=3786453015
   1605 20.910516029   192.168.109.136       172.16.30.1           FTP-DATA 1514   FTP Data: 1448 bytes (PASV) (retr )
   1606 20.910521756   172.16.30.1           192.168.109.136       TCP      66     40546 > 43177 [ACK] Seq=1 Ack=1155505 Win=2198528 Len=0 TSval=1802216520 TSecr=3786453015
   1607 20.911274788   192.168.109.136       172.16.30.1           FTP-DATA 1514   FTP Data: 1448 bytes (PASV) (retr )
   1608 20.911281982   172.16.30.1           192.168.109.136       TCP      66     40546 > 43177 [ACK] Seq=1 Ack=1156953 Win=2201344 Len=0 TSval=1802216520 TSecr=3786453016
   1609 20.911396033   192.168.109.136       172.16.30.1           FTP-DATA 1514   FTP Data: 1448 bytes (PASV) (retr )
   1610 20.911401760   172.16.30.1           192.168.109.136       TCP      66     40546 > 43177 [ACK] Seq=1 Ack=1158401 Win=2204288 Len=0 TSval=1802216520 TSecr=3786453016
   1611 20.911518814   192.168.109.136       172.16.30.1           FTP-DATA 1514   FTP Data: 1448 bytes (PASV) (retr )
   1612 20.911525100   172.16.30.1           192.168.109.136       TCP      66     40546 > 43177 [ACK] Seq=1 Ack=1159849 Win=2207232 Len=0 TSval=1802216521 TSecr=3786453017
   1613 20.911642574   192.168.109.136       172.16.30.1           FTP-DATA 1514   FTP Data: 1448 bytes (PASV) (retr )
   1614 20.911649209   172.16.30.1           192.168.109.136       TCP      66     40546 > 43177 [ACK] Seq=1 Ack=1161297 Win=2210048 Len=0 TSval=1802216521 TSecr=3786453017
   1615 20.917652794   192.168.109.136       172.16.30.1           FTP-DATA 1514   FTP Data: 1448 bytes (PASV) (retr )
   1616 20.917664108   172.16.30.1           192.168.109.136       TCP      66     40546 > 43177 [ACK] Seq=1 Ack=1162745 Win=2212992 Len=0 TSval=1802216527 TSecr=3786453023
   1617 20.918759155   192.168.109.136       172.16.30.1           FTP-DATA 1514   FTP Data: 1448 bytes (PASV) (retr )
   1618 20.918766418   172.16.30.1           192.168.109.136       TCP      66     40546 > 43177 [ACK] Seq=1 Ack=1164193 Win=2215936 Len=0 TSval=1802216528 TSecr=3786453025
   1619 20.918882844   192.168.109.136       172.16.30.1           FTP-DATA 1514   FTP Data: 1448 bytes (PASV) (retr )
   1620 20.918889689   172.16.30.1           192.168.109.136       TCP      66     40546 > 43177 [ACK] Seq=1 Ack=1165641 Win=2218752 Len=0 TSval=1802216528 TSecr=3786453025
   1621 20.919005346   192.168.109.136       172.16.30.1           FTP-DATA 1514   FTP Data: 1448 bytes (PASV) (retr )
   1622 20.919012051   172.16.30.1           192.168.109.136       TCP      66     40546 > 43177 [ACK] Seq=1 Ack=1167089 Win=2219008 Len=0 TSval=1802216528 TSecr=3786453025
   1623 20.919128826   192.168.109.136       172.16.30.1           FTP-DATA 1514   FTP Data: 1448 bytes (PASV) (retr )
   1624 20.920236863   192.168.109.136       172.16.30.1           FTP-DATA 1514   FTP Data: 1448 bytes (PASV) (retr )
   1625 20.920243987   172.16.30.1           192.168.109.136       TCP      66     40546 > 43177 [ACK] Seq=1 Ack=1169985 Win=2219008 Len=0 TSval=1802216529 TSecr=3786453025
   1626 20.920359505   192.168.109.136       172.16.30.1           FTP-DATA 1514   FTP Data: 1448 bytes (PASV) (retr )
   1627 20.921465517   192.168.109.136       172.16.30.1           FTP-DATA 1514   FTP Data: 1448 bytes (PASV) (retr )
   1628 20.921471314   172.16.30.1           192.168.109.136       TCP      66     40546 > 43177 [ACK] Seq=1 Ack=1172881 Win=2219008 Len=0 TSval=1802216530 TSecr=3786453025
   1629 20.923190535   192.168.109.136       172.16.30.1           FTP-DATA 1514   FTP Data: 1448 bytes (PASV) (retr )
   1630 20.923313177   192.168.109.136       172.16.30.1           FTP-DATA 1514   FTP Data: 1448 bytes (PASV) (retr )
   1631 20.923318764   172.16.30.1           192.168.109.136       TCP      66     40546 > 43177 [ACK] Seq=1 Ack=1175777 Win=2219008 Len=0 TSval=1802216532 TSecr=3786453028
   1632 20.925404304   192.168.109.136       172.16.30.1           FTP-DATA 1514   FTP Data: 1448 bytes (PASV) (retr )
   1633 20.925526388   192.168.109.136       172.16.30.1           FTP-DATA 1514   FTP Data: 1448 bytes (PASV) (retr )
   1634 20.925532184   172.16.30.1           192.168.109.136       TCP      66     40546 > 43177 [ACK] Seq=1 Ack=1178673 Win=2219008 Len=0 TSval=1802216535 TSecr=3786453031
   1635 20.926635891   192.168.109.136       172.16.30.1           FTP-DATA 1514   FTP Data: 1448 bytes (PASV) (retr )
   1636 20.926759092   192.168.109.136       172.16.30.1           FTP-DATA 1514   FTP Data: 1448 bytes (PASV) (retr )
   1637 20.926764470   172.16.30.1           192.168.109.136       TCP      66     40546 > 43177 [ACK] Seq=1 Ack=1181569 Win=2219008 Len=0 TSval=1802216536 TSecr=3786453032
   1638 20.927740436   192.168.109.136       172.16.30.1           FTP-DATA 1514   FTP Data: 1448 bytes (PASV) (retr )
   1639 20.927864266   192.168.109.136       172.16.30.1           FTP-DATA 1514   FTP Data: 1448 bytes (PASV) (retr )
   1640 20.927869853   172.16.30.1           192.168.109.136       TCP      66     40546 > 43177 [ACK] Seq=1 Ack=1184465 Win=2219008 Len=0 TSval=1802216537 TSecr=3786453033
   1641 20.929710110   192.168.109.136       172.16.30.1           FTP-DATA 1514   FTP Data: 1448 bytes (PASV) (retr )
   1642 20.929833101   192.168.109.136       172.16.30.1           FTP-DATA 1514   FTP Data: 1448 bytes (PASV) (retr )
   1643 20.929838478   172.16.30.1           192.168.109.136       TCP      66     40546 > 43177 [ACK] Seq=1 Ack=1187361 Win=2219008 Len=0 TSval=1802216539 TSecr=3786453035
   1644 20.930939322   192.168.109.136       172.16.30.1           FTP-DATA 1514   FTP Data: 1448 bytes (PASV) (retr )
   1645 20.931063221   192.168.109.136       172.16.30.1           FTP-DATA 1514   FTP Data: 1448 bytes (PASV) (retr )
   1646 20.931069018   172.16.30.1           192.168.109.136       TCP      66     40546 > 43177 [ACK] Seq=1 Ack=1190257 Win=2219008 Len=0 TSval=1802216540 TSecr=3786453036
   1647 20.931185863   192.168.109.136       172.16.30.1           FTP-DATA 1514   FTP Data: 1448 bytes (PASV) (retr )
   1648 20.931310460   192.168.109.136       172.16.30.1           FTP-DATA 1514   FTP Data: 1448 bytes (PASV) (retr )
   1649 20.931316257   172.16.30.1           192.168.109.136       TCP      66     40546 > 43177 [ACK] Seq=1 Ack=1193153 Win=2219008 Len=0 TSval=1802216540 TSecr=3786453037
...
  91250 28.949030321   192.168.109.136       172.16.30.1           FTP-DATA 1514   FTP Data: 1448 bytes (PASV) (retr )
  91251 28.949153591   192.168.109.136       172.16.30.1           FTP-DATA 1514   FTP Data: 1448 bytes (PASV) (retr )
  91252 28.949159807   172.16.30.1           192.168.109.136       TCP      66     40546 > 43177 [ACK] Seq=1 Ack=88089081 Win=2471296 Len=0 TSval=1802224558 TSecr=3786461055
  91253 28.949276582   192.168.109.136       172.16.30.1           FTP-DATA 1514   FTP Data: 1448 bytes (PASV) (retr )
  91254 28.949400272   192.168.109.136       172.16.30.1           FTP-DATA 1514   FTP Data: 1448 bytes (PASV) (retr )
  91255 28.949406697   172.16.30.1           192.168.109.136       TCP      66     40546 > 43177 [ACK] Seq=1 Ack=88091977 Win=2471296 Len=0 TSval=1802224558 TSecr=3786461055
  91256 28.949522285   192.168.109.136       172.16.30.1           FTP-DATA 1514   FTP Data: 1448 bytes (PASV) (retr )
  91257 28.949646953   192.168.109.136       172.16.30.1           FTP-DATA 1514   FTP Data: 1448 bytes (PASV) (retr )
  91258 28.949653657   172.16.30.1           192.168.109.136       TCP      66     40546 > 43177 [ACK] Seq=1 Ack=88094873 Win=2471296 Len=0 TSval=1802224559 TSecr=3786461056
  91259 28.949769385   192.168.109.136       172.16.30.1           FTP-DATA 1514   FTP Data: 1448 bytes (PASV) (retr )
  91260 28.949892097   192.168.109.136       172.16.30.1           FTP-DATA 1514   FTP Data: 1448 bytes (PASV) (retr )
  91261 28.949898173   172.16.30.1           192.168.109.136       TCP      66     40546 > 43177 [ACK] Seq=1 Ack=88097769 Win=2471296 Len=0 TSval=1802224559 TSecr=3786461056
  91262 28.950147996   192.168.109.136       172.16.30.1           FTP-DATA 2962   FTP Data: 2896 bytes (PASV) (retr )
  91263 28.950164479   172.16.30.1           192.168.109.136       TCP      66     40546 > 43177 [ACK] Seq=1 Ack=88100665 Win=2470272 Len=0 TSval=1802224559 TSecr=3786461056
  91264 28.950249895   192.168.109.136       172.16.30.1           FTP-DATA 1514   FTP Data: 1448 bytes (PASV) (retr )
  91265 28.950383083   192.168.109.136       172.16.30.1           FTP-DATA 1514   FTP Data: 1448 bytes (PASV) (retr )
  91266 28.950388601   172.16.30.1           192.168.109.136       TCP      66     40546 > 43177 [ACK] Seq=1 Ack=88103561 Win=2471296 Len=0 TSval=1802224559 TSecr=3786461056
  91267 28.950507541   192.168.109.136       172.16.30.1           FTP-DATA 1514   FTP Data: 1448 bytes (PASV) (retr )
  91268 28.950630183   192.168.109.136       172.16.30.1           FTP-DATA 1514   FTP Data: 1448 bytes (PASV) (retr )
  91269 28.950636399   172.16.30.1           192.168.109.136       TCP      66     40546 > 43177 [ACK] Seq=1 Ack=88106457 Win=2471296 Len=0 TSval=1802224560 TSecr=3786461057
  91270 28.950752685   192.168.109.136       172.16.30.1           FTP-DATA 1514   FTP Data: 1448 bytes (PASV) (retr )
  91271 28.950876933   192.168.109.136       172.16.30.1           FTP-DATA 1514   FTP Data: 1448 bytes (PASV) (retr )
  91272 28.950883219   172.16.30.1           192.168.109.136       TCP      66     40546 > 43177 [ACK] Seq=1 Ack=88109353 Win=2471296 Len=0 TSval=1802224560 TSecr=3786461058
  91273 28.950999156   192.168.109.136       172.16.30.1           FTP-DATA 1514   FTP Data: 1448 bytes (PASV) (retr )
  91274 28.951121868   192.168.109.136       172.16.30.1           FTP-DATA 1514   FTP Data: 1448 bytes (PASV) (retr )
  91275 28.951127665   172.16.30.1           192.168.109.136       TCP      66     40546 > 43177 [ACK] Seq=1 Ack=88112249 Win=2471296 Len=0 TSval=1802224560 TSecr=3786461058
  91276 28.951245278   192.168.109.136       172.16.30.1           FTP-DATA 1514   FTP Data: 1448 bytes (PASV) (retr )
  91277 28.951371342   192.168.109.136       172.16.30.1           FTP-DATA 1514   FTP Data: 1448 bytes (PASV) (retr )
  91278 28.951376091   172.16.30.1           192.168.109.136       TCP      66     40546 > 43177 [ACK] Seq=1 Ack=88115145 Win=2471296 Len=0 TSval=1802224560 TSecr=3786461058
  91279 28.951490911   192.168.109.136       172.16.30.1           FTP-DATA 1514   FTP Data: 1448 bytes (PASV) (retr )
  91280 28.951615019   192.168.109.136       172.16.30.1           FTP-DATA 1514   FTP Data: 1448 bytes (PASV) (retr )
  91281 28.951620746   172.16.30.1           192.168.109.136       TCP      66     40546 > 43177 [ACK] Seq=1 Ack=88118041 Win=2471296 Len=0 TSval=1802224561 TSecr=3786461058
  91282 28.951738220   192.168.109.136       172.16.30.1           FTP-DATA 1514   FTP Data: 1448 bytes (PASV) (retr )
  91283 28.951860303   192.168.109.136       172.16.30.1           FTP-DATA 1514   FTP Data: 1448 bytes (PASV) (retr )
  91284 28.951865890   172.16.30.1           192.168.109.136       TCP      66     40546 > 43177 [ACK] Seq=1 Ack=88120937 Win=2471296 Len=0 TSval=1802224561 TSecr=3786461058
  91285 28.951983853   192.168.109.136       172.16.30.1           FTP-DATA 1514   FTP Data: 1448 bytes (PASV) (retr )
  91286 28.952051110   192.168.109.136       172.16.30.1           FTP-DATA 866    FTP Data: 800 bytes (PASV) (retr )
  91287 28.952061377   172.16.30.1           192.168.109.136       TCP      66     40546 > 43177 [ACK] Seq=1 Ack=88123186 Win=2471296 Len=0 TSval=1802224561 TSecr=3786461058
  91288 28.953211040   192.168.109.136       172.16.30.1           FTP      90     Response: 226 Transfer complete.
  91289 28.953219211   172.16.30.1           192.168.109.136       TCP      66     46984 > 21 [ACK] Seq=46 Ack=248 Win=64256 Len=0 TSval=1802224562 TSecr=3786461079
  91290 29.323852647   172.16.30.1           172.16.1.1            DNS      88     Standard query 0xee9e PTR 136.109.168.192.in-addr.arpa
  91291 29.324930722   172.16.1.1            172.16.30.1           DNS      88     Standard query response 0xee9e Server failure PTR 136.109.168.192.in-addr.arpa
  91292 29.324984710   172.16.30.1           172.16.1.1            DNS      88     Standard query 0xee9e PTR 136.109.168.192.in-addr.arpa
  91293 29.326027305   172.16.1.1            172.16.30.1           DNS      88     Standard query response 0xee9e Server failure PTR 136.109.168.192.in-addr.arpa
  91294 29.343040931   172.16.30.1           192.168.109.136       FTP      70     Request: quit
  91295 29.344197718   192.168.109.136       172.16.30.1           TCP      66     21 > 46984 [ACK] Seq=248 Ack=50 Win=65280 Len=0 TSval=3786461470 TSecr=1802224952
  91296 29.344210778   172.16.30.1           192.168.109.136       FTP      67     Request: 
  91297 29.345258682   192.168.109.136       172.16.30.1           TCP      66     21 > 46984 [ACK] Seq=248 Ack=51 Win=65280 Len=0 TSval=3786461471 TSecr=1802224953
  91298 29.345314834   192.168.109.136       172.16.30.1           FTP      80     Response: 221 Goodbye.
  91299 29.345321539   172.16.30.1           192.168.109.136       TCP      66     46984 > 21 [ACK] Seq=51 Ack=262 Win=64256 Len=0 TSval=1802224954 TSecr=3786461471
  91300 29.345344727   172.16.30.1           192.168.109.136       TCP      66     46984 > 21 [FIN, ACK] Seq=51 Ack=262 Win=64256 Len=0 TSval=1802224954 TSecr=3786461471
  91301 29.345362187   172.16.30.1           192.168.109.136       TCP      66     40546 > 43177 [FIN, ACK] Seq=1 Ack=88123186 Win=2472448 Len=0 TSval=1802224954 TSecr=3786461058
  91302 29.345362187   192.168.109.136       172.16.30.1           TCP      66     21 > 46984 [FIN, ACK] Seq=262 Ack=51 Win=65280 Len=0 TSval=3786461471 TSecr=1802224953
  91303 29.345369241   172.16.30.1           192.168.109.136       TCP      66     46984 > 21 [ACK] Seq=52 Ack=263 Win=64256 Len=0 TSval=1802224954 TSecr=3786461471
  91304 29.346303373   192.168.109.136       172.16.30.1           TCP      66     43177 > 40546 [ACK] Seq=88123186 Ack=2 Win=65280 Len=0 TSval=3786461472 TSecr=1802224954
  91305 29.346411138   192.168.109.136       172.16.30.1           TCP      66     21 > 46984 [ACK] Seq=263 Ack=52 Win=65280 Len=0 TSval=3786461473 TSecr=1802224954
  91306 30.073158009   Cisco_3a:fa:83        Spanning-tree-(for-bridges)_00 STP      60     Conf. Root = 32768/30/fc:fb:fb:3a:fa:80  Cost = 0  Port = 0x8003
  91307 31.083305863   Cisco_3a:fa:83        Cisco_3a:fa:83        LOOP     60     Reply
  91308 32.073093771   Cisco_3a:fa:83        Spanning-tree-(for-bridges)_00 STP      60     Conf. Root = 32768/30/fc:fb:fb:3a:fa:80  Cost = 0  Port = 0x8003
  91309 34.077969011   Cisco_3a:fa:83        Spanning-tree-(for-bridges)_00 STP      60     Conf. Root = 32768/30/fc:fb:fb:3a:fa:80  Cost = 0  Port = 0x8003
