No.     Time           Source                Destination           Protocol Length Info
      1 0.000000000    Cisco_3a:fa:85        Spanning-tree-(for-bridges)_00 STP      60     Conf. Root = 32768/31/fc:fb:fb:3a:fa:80  Cost = 0  Port = 0x8005
      2 0.644046923    Cisco_3a:fa:85        Cisco_3a:fa:85        LOOP     60     Reply
      3 2.002801749    Cisco_3a:fa:85        Spanning-tree-(for-bridges)_00 STP      60     Conf. Root = 32768/31/fc:fb:fb:3a:fa:80  Cost = 0  Port = 0x8005
      4 3.245221663    Cisco_3a:fa:85        CDP/VTP/DTP/PAgP/UDLD CDP      435    Device ID: tux-sw3  Port ID: FastEthernet0/3  
      5 3.367638583    172.16.31.1           172.16.1.1            DNS      76     Standard query 0x6cc6 A netlab1.fe.up.pt
      6 3.368886343    172.16.1.1            172.16.31.1           DNS      340    Standard query response 0x6cc6 A netlab1.fe.up.pt A 192.168.109.136 NS ns1.up.pt NS ns3.up.pt NS ns4.up.pt NS ns2.up.pt A 193.137.55.30 AAAA 2001:690:2200:a10::30 A 193.137.55.31 AAAA 2001:690:2200:a10::31 A 193.137.55.32 AAAA 2001:690:2200:a10::32 A 193.137.55.33 AAAA 2001:690:2200:a10::33
      7 3.369010868    172.16.31.1           192.168.109.136       TCP      74     32830 > 21 [SYN] Seq=0 Win=64240 Len=0 MSS=1460 SACK_PERM=1 TSval=3520836605 TSecr=0 WS=128
      8 3.370462212    192.168.109.136       172.16.31.1           TCP      74     21 > 32830 [SYN, ACK] Seq=0 Ack=1 Win=65160 Len=0 MSS=1460 SACK_PERM=1 TSval=3786446055 TSecr=3520836605 WS=128
      9 3.370499786    172.16.31.1           192.168.109.136       TCP      66     32830 > 21 [ACK] Seq=1 Ack=1 Win=64256 Len=0 TSval=3520836606 TSecr=3786446055
     10 3.372678931    192.168.109.136       172.16.31.1           FTP      100    Response: 220 Welcome to netlab-FTP server
     11 3.372701769    172.16.31.1           192.168.109.136       TCP      66     32830 > 21 [ACK] Seq=1 Ack=35 Win=64256 Len=0 TSval=3520836608 TSecr=3786446057
     12 3.372727470    172.16.31.1           192.168.109.136       FTP      71     Request: user 
     13 3.373636018    192.168.109.136       172.16.31.1           TCP      66     21 > 32830 [ACK] Seq=35 Ack=6 Win=65280 Len=0 TSval=3786446058 TSecr=3520836608
     14 3.373654595    172.16.31.1           192.168.109.136       FTP      71     Request: rcom
     15 3.374745635    192.168.109.136       172.16.31.1           TCP      66     21 > 32830 [ACK] Seq=35 Ack=11 Win=65280 Len=0 TSval=3786446059 TSecr=3520836609
     16 3.374805488    192.168.109.136       172.16.31.1           FTP      100    Response: 331 Please specify the password.
     17 3.374827976    172.16.31.1           192.168.109.136       FTP      71     Request: pass 
     18 3.375721020    192.168.109.136       172.16.31.1           TCP      66     21 > 32830 [ACK] Seq=69 Ack=16 Win=65280 Len=0 TSval=3786446060 TSecr=3520836610
     19 3.375734080    172.16.31.1           192.168.109.136       FTP      71     Request: rcom
     20 3.376599117    192.168.109.136       172.16.31.1           TCP      66     21 > 32830 [ACK] Seq=69 Ack=21 Win=65280 Len=0 TSval=3786446061 TSecr=3520836611
     21 3.398294547    192.168.109.136       172.16.31.1           FTP      89     Response: 230 Login successful.
     22 3.398354539    172.16.31.1           192.168.109.136       FTP      71     Request: pasv
     23 3.399192060    192.168.109.136       172.16.31.1           TCP      66     21 > 32830 [ACK] Seq=92 Ack=26 Win=65280 Len=0 TSval=3786446084 TSecr=3520836634
     24 3.399277334    192.168.109.136       172.16.31.1           FTP      119    Response: 227 Entering Passive Mode (192,168,109,136,165,42).
     25 3.399344101    172.16.31.1           192.168.109.136       TCP      74     40742 > 42282 [SYN] Seq=0 Win=64240 Len=0 MSS=1460 SACK_PERM=1 TSval=3520836635 TSecr=0 WS=128
     26 3.400109407    192.168.109.136       172.16.31.1           TCP      74     42282 > 40742 [SYN, ACK] Seq=0 Ack=1 Win=65160 Len=0 MSS=1460 SACK_PERM=1 TSval=3786446085 TSecr=3520836635 WS=128
     27 3.400139089    172.16.31.1           192.168.109.136       TCP      66     40742 > 42282 [ACK] Seq=1 Ack=1 Win=64256 Len=0 TSval=3520836636 TSecr=3786446085
     28 3.400166886    172.16.31.1           192.168.109.136       FTP      71     Request: retr 
     29 3.400900345    192.168.109.136       172.16.31.1           TCP      66     21 > 32830 [ACK] Seq=145 Ack=31 Win=65280 Len=0 TSval=3786446085 TSecr=3520836636
     30 3.400912357    172.16.31.1           192.168.109.136       FTP      81     Request: files/crab.mp4
     31 3.401728926    192.168.109.136       172.16.31.1           TCP      66     21 > 32830 [ACK] Seq=145 Ack=46 Win=65280 Len=0 TSval=3786446086 TSecr=3520836636
     32 3.402044253    192.168.109.136       172.16.31.1           FTP-DATA 1514   FTP Data: 1448 bytes (PASV) (retr )
     33 3.402053821    172.16.31.1           192.168.109.136       TCP      66     40742 > 42282 [ACK] Seq=1 Ack=1449 Win=64128 Len=0 TSval=3520836638 TSecr=3786446086
     34 3.402165984    192.168.109.136       172.16.31.1           FTP-DATA 1514   FTP Data: 1448 bytes (PASV) (retr )
     35 3.402173457    172.16.31.1           192.168.109.136       TCP      66     40742 > 42282 [ACK] Seq=1 Ack=2897 Win=63488 Len=0 TSval=3520836638 TSecr=3786446086
     36 3.402288623    192.168.109.136       172.16.31.1           FTP-DATA 1514   FTP Data: 1448 bytes (PASV) (retr )
     37 3.402294490    172.16.31.1           192.168.109.136       TCP      66     40742 > 42282 [ACK] Seq=1 Ack=4345 Win=62464 Len=0 TSval=3520836638 TSecr=3786446086
     38 3.402412519    192.168.109.136       172.16.31.1           FTP-DATA 1514   FTP Data: 1448 bytes (PASV) (retr )
     39 3.402418525    172.16.31.1           192.168.109.136       TCP      66     40742 > 42282 [ACK] Seq=1 Ack=5793 Win=61440 Len=0 TSval=3520836638 TSecr=3786446086
     40 3.402534949    192.168.109.136       172.16.31.1           FTP-DATA 1514   FTP Data: 1448 bytes (PASV) (retr )
     41 3.402540676    172.16.31.1           192.168.109.136       TCP      66     40742 > 42282 [ACK] Seq=1 Ack=7241 Win=60544 Len=0 TSval=3520836638 TSecr=3786446086
     42 3.402657797    192.168.109.136       172.16.31.1           FTP-DATA 1514   FTP Data: 1448 bytes (PASV) (retr )
     43 3.402663943    172.16.31.1           192.168.109.136       TCP      66     40742 > 42282 [ACK] Seq=1 Ack=8689 Win=59520 Len=0 TSval=3520836638 TSecr=3786446086
     44 3.402781763    192.168.109.136       172.16.31.1           FTP-DATA 1514   FTP Data: 1448 bytes (PASV) (retr )
     45 3.402788118    172.16.31.1           192.168.109.136       TCP      66     40742 > 42282 [ACK] Seq=1 Ack=10137 Win=58496 Len=0 TSval=3520836638 TSecr=3786446086
     46 3.402905100    192.168.109.136       172.16.31.1           FTP-DATA 1514   FTP Data: 1448 bytes (PASV) (retr )
     47 3.402912713    172.16.31.1           192.168.109.136       TCP      66     40742 > 42282 [ACK] Seq=1 Ack=11585 Win=57472 Len=0 TSval=3520836638 TSecr=3786446086
     48 3.403027041    192.168.109.136       172.16.31.1           FTP-DATA 1514   FTP Data: 1448 bytes (PASV) (retr )
     49 3.403033606    172.16.31.1           192.168.109.136       TCP      66     40742 > 42282 [ACK] Seq=1 Ack=13033 Win=56576 Len=0 TSval=3520836639 TSecr=3786446086
     50 3.403160226    192.168.109.136       172.16.31.1           FTP-DATA 1514   FTP Data: 1448 bytes (PASV) (retr )
     51 3.403166651    172.16.31.1           192.168.109.136       TCP      66     40742 > 42282 [ACK] Seq=1 Ack=14481 Win=55552 Len=0 TSval=3520836639 TSecr=3786446086
     52 3.403169654    192.168.109.136       172.16.31.1           FTP      144    Response: 150 Opening BINARY mode data connection for files/crab.mp4 (88123184 bytes).
     53 3.403286985    192.168.109.136       172.16.31.1           FTP-DATA 1514   FTP Data: 1448 bytes (PASV) (retr )
     54 3.403295715    172.16.31.1           192.168.109.136       TCP      66     40742 > 42282 [ACK] Seq=1 Ack=15929 Win=54528 Len=0 TSval=3520836639 TSecr=3786446087
     55 3.403409345    192.168.109.136       172.16.31.1           FTP-DATA 1514   FTP Data: 1448 bytes (PASV) (retr )
     56 3.403415980    172.16.31.1           192.168.109.136       TCP      66     40742 > 42282 [ACK] Seq=1 Ack=17377 Win=53504 Len=0 TSval=3520836639 TSecr=3786446087
     57 3.403533520    192.168.109.136       172.16.31.1           FTP-DATA 1514   FTP Data: 1448 bytes (PASV) (retr )
     58 3.403540295    172.16.31.1           192.168.109.136       TCP      66     40742 > 42282 [ACK] Seq=1 Ack=18825 Win=52608 Len=0 TSval=3520836639 TSecr=3786446087
     59 3.403655251    192.168.109.136       172.16.31.1           FTP-DATA 1514   FTP Data: 1448 bytes (PASV) (retr )
     60 3.403661397    172.16.31.1           192.168.109.136       TCP      66     40742 > 42282 [ACK] Seq=1 Ack=20273 Win=51584 Len=0 TSval=3520836639 TSecr=3786446088
     61 3.403778519    192.168.109.136       172.16.31.1           FTP-DATA 1514   FTP Data: 1448 bytes (PASV) (retr )
     62 3.403785154    172.16.31.1           192.168.109.136       TCP      66     40742 > 42282 [ACK] Seq=1 Ack=21721 Win=50560 Len=0 TSval=3520836639 TSecr=3786446088
     63 3.403900739    192.168.109.136       172.16.31.1           FTP-DATA 1514   FTP Data: 1448 bytes (PASV) (retr )
     64 3.403907164    172.16.31.1           192.168.109.136       TCP      66     40742 > 42282 [ACK] Seq=1 Ack=23169 Win=49536 Len=0 TSval=3520836639 TSecr=3786446088
     65 3.404024984    192.168.109.136       172.16.31.1           FTP-DATA 1514   FTP Data: 1448 bytes (PASV) (retr )
     66 3.404147483    192.168.109.136       172.16.31.1           FTP-DATA 1514   FTP Data: 1448 bytes (PASV) (retr )
     67 3.404270681    192.168.109.136       172.16.31.1           FTP-DATA 1514   FTP Data: 1448 bytes (PASV) (retr )
     68 3.404394088    192.168.109.136       172.16.31.1           FTP-DATA 1514   FTP Data: 1448 bytes (PASV) (retr )
     69 3.404517914    192.168.109.136       172.16.31.1           FTP-DATA 1514   FTP Data: 1448 bytes (PASV) (retr )
     70 3.404640413    192.168.109.136       172.16.31.1           FTP-DATA 1514   FTP Data: 1448 bytes (PASV) (retr )
     71 3.404764030    192.168.109.136       172.16.31.1           FTP-DATA 1514   FTP Data: 1448 bytes (PASV) (retr )
     72 3.404886669    192.168.109.136       172.16.31.1           FTP-DATA 1514   FTP Data: 1448 bytes (PASV) (retr )
     73 3.405008470    192.168.109.136       172.16.31.1           FTP-DATA 1514   FTP Data: 1448 bytes (PASV) (retr )
     74 3.416876651    192.168.109.136       172.16.31.1           FTP-DATA 1514   FTP Data: 1448 bytes (PASV) (retr )
     75 3.419194639    172.16.31.1           192.168.109.136       TCP      66     40742 > 42282 [ACK] Seq=1 Ack=37649 Win=39552 Len=0 TSval=3520836655 TSecr=3786446088
     76 3.420041308    192.168.109.136       172.16.31.1           FTP-DATA 1514   FTP Data: 1448 bytes (PASV) (retr )
     77 3.420159687    192.168.109.136       172.16.31.1           FTP-DATA 1514   FTP Data: 1448 bytes (PASV) (retr )
     78 3.420168627    172.16.31.1           192.168.109.136       TCP      66     40742 > 42282 [ACK] Seq=1 Ack=40545 Win=64128 Len=0 TSval=3520836656 TSecr=3786446104
     79 3.420281488    192.168.109.136       172.16.31.1           FTP-DATA 1514   FTP Data: 1448 bytes (PASV) (retr )
     80 3.420406990    192.168.109.136       172.16.31.1           FTP-DATA 1514   FTP Data: 1448 bytes (PASV) (retr )
     81 3.420413625    172.16.31.1           192.168.109.136       TCP      66     40742 > 42282 [ACK] Seq=1 Ack=43441 Win=64128 Len=0 TSval=3520836656 TSecr=3786446104
     82 3.420528093    192.168.109.136       172.16.31.1           FTP-DATA 1514   FTP Data: 1448 bytes (PASV) (retr )
     83 3.420652128    192.168.109.136       172.16.31.1           FTP-DATA 1514   FTP Data: 1448 bytes (PASV) (retr )
     84 3.420658693    172.16.31.1           192.168.109.136       TCP      66     40742 > 42282 [ACK] Seq=1 Ack=46337 Win=64128 Len=0 TSval=3520836656 TSecr=3786446104
     85 3.420774418    192.168.109.136       172.16.31.1           FTP-DATA 1514   FTP Data: 1448 bytes (PASV) (retr )
     86 3.420897756    192.168.109.136       172.16.31.1           FTP-DATA 1514   FTP Data: 1448 bytes (PASV) (retr )
     87 3.420904390    172.16.31.1           192.168.109.136       TCP      66     40742 > 42282 [ACK] Seq=1 Ack=49233 Win=64128 Len=0 TSval=3520836656 TSecr=3786446104
     88 3.421023048    192.168.109.136       172.16.31.1           FTP-DATA 1514   FTP Data: 1448 bytes (PASV) (retr )
     89 3.421029963    172.16.31.1           192.168.109.136       TCP      66     40742 > 42282 [ACK] Seq=1 Ack=50681 Win=67072 Len=0 TSval=3520836657 TSecr=3786446104
     90 3.421143383    192.168.109.136       172.16.31.1           FTP-DATA 1514   FTP Data: 1448 bytes (PASV) (retr )
     91 3.421150087    172.16.31.1           192.168.109.136       TCP      66     40742 > 42282 [ACK] Seq=1 Ack=52129 Win=69888 Len=0 TSval=3520836657 TSecr=3786446104
     92 3.421266301    192.168.109.136       172.16.31.1           FTP-DATA 1514   FTP Data: 1448 bytes (PASV) (retr )
     93 3.421272796    172.16.31.1           192.168.109.136       TCP      66     40742 > 42282 [ACK] Seq=1 Ack=53577 Win=72832 Len=0 TSval=3520836657 TSecr=3786446104
     94 3.421389080    192.168.109.136       172.16.31.1           FTP-DATA 1514   FTP Data: 1448 bytes (PASV) (retr )
     95 3.421395714    172.16.31.1           192.168.109.136       TCP      66     40742 > 42282 [ACK] Seq=1 Ack=55025 Win=75776 Len=0 TSval=3520836657 TSecr=3786446105
     96 3.421512976    192.168.109.136       172.16.31.1           FTP-DATA 1514   FTP Data: 1448 bytes (PASV) (retr )
     97 3.421519750    172.16.31.1           192.168.109.136       TCP      66     40742 > 42282 [ACK] Seq=1 Ack=56473 Win=78592 Len=0 TSval=3520836657 TSecr=3786446105
     98 3.421635475    192.168.109.136       172.16.31.1           FTP-DATA 1514   FTP Data: 1448 bytes (PASV) (retr )
     99 3.421642040    172.16.31.1           192.168.109.136       TCP      66     40742 > 42282 [ACK] Seq=1 Ack=57921 Win=81536 Len=0 TSval=3520836657 TSecr=3786446105
    100 3.421758114    192.168.109.136       172.16.31.1           FTP-DATA 1514   FTP Data: 1448 bytes (PASV) (retr )
    101 3.421765168    172.16.31.1           192.168.109.136       TCP      66     40742 > 42282 [ACK] Seq=1 Ack=59369 Win=84480 Len=0 TSval=3520836657 TSecr=3786446105
    102 3.421883057    192.168.109.136       172.16.31.1           FTP-DATA 1514   FTP Data: 1448 bytes (PASV) (retr )
    103 3.421889413    172.16.31.1           192.168.109.136       TCP      66     40742 > 42282 [ACK] Seq=1 Ack=60817 Win=87296 Len=0 TSval=3520836657 TSecr=3786446106
    104 3.422004788    192.168.109.136       172.16.31.1           FTP-DATA 1514   FTP Data: 1448 bytes (PASV) (retr )
    105 3.422011284    172.16.31.1           192.168.109.136       TCP      66     40742 > 42282 [ACK] Seq=1 Ack=62265 Win=90240 Len=0 TSval=3520836658 TSecr=3786446106
    106 3.422130780    192.168.109.136       172.16.31.1           FTP-DATA 1514   FTP Data: 1448 bytes (PASV) (retr )
    107 3.422137415    172.16.31.1           192.168.109.136       TCP      66     40742 > 42282 [ACK] Seq=1 Ack=63713 Win=93056 Len=0 TSval=3520836658 TSecr=3786446106
    108 3.422250974    192.168.109.136       172.16.31.1           FTP-DATA 1514   FTP Data: 1448 bytes (PASV) (retr )
    109 3.422257190    172.16.31.1           192.168.109.136       TCP      66     40742 > 42282 [ACK] Seq=1 Ack=65161 Win=96000 Len=0 TSval=3520836658 TSecr=3786446106
    110 3.422373893    192.168.109.136       172.16.31.1           FTP-DATA 1514   FTP Data: 1448 bytes (PASV) (retr )
    111 3.422380388    172.16.31.1           192.168.109.136       TCP      66     40742 > 42282 [ACK] Seq=1 Ack=66609 Win=98944 Len=0 TSval=3520836658 TSecr=3786446106
    112 3.422496881    192.168.109.136       172.16.31.1           FTP-DATA 1514   FTP Data: 1448 bytes (PASV) (retr )
    113 3.422503446    172.16.31.1           192.168.109.136       TCP      66     40742 > 42282 [ACK] Seq=1 Ack=68057 Win=101760 Len=0 TSval=3520836658 TSecr=3786446106
    114 3.422620148    192.168.109.136       172.16.31.1           FTP-DATA 1514   FTP Data: 1448 bytes (PASV) (retr )
    115 3.422626783    172.16.31.1           192.168.109.136       TCP      66     40742 > 42282 [ACK] Seq=1 Ack=69505 Win=104704 Len=0 TSval=3520836658 TSecr=3786446106
    116 3.422743067    192.168.109.136       172.16.31.1           FTP-DATA 1514   FTP Data: 1448 bytes (PASV) (retr )
    117 3.422749212    172.16.31.1           192.168.109.136       TCP      66     40742 > 42282 [ACK] Seq=1 Ack=70953 Win=107648 Len=0 TSval=3520836658 TSecr=3786446107
    118 3.422865845    192.168.109.136       172.16.31.1           FTP-DATA 1514   FTP Data: 1448 bytes (PASV) (retr )
    119 3.422872480    172.16.31.1           192.168.109.136       TCP      66     40742 > 42282 [ACK] Seq=1 Ack=72401 Win=110464 Len=0 TSval=3520836658 TSecr=3786446107
    120 3.422989602    192.168.109.136       172.16.31.1           FTP-DATA 1514   FTP Data: 1448 bytes (PASV) (retr )
    121 3.422995817    172.16.31.1           192.168.109.136       TCP      66     40742 > 42282 [ACK] Seq=1 Ack=73849 Win=113408 Len=0 TSval=3520836659 TSecr=3786446107
    122 3.423112171    192.168.109.136       172.16.31.1           FTP-DATA 1514   FTP Data: 1448 bytes (PASV) (retr )
    123 3.423118875    172.16.31.1           192.168.109.136       TCP      66     40742 > 42282 [ACK] Seq=1 Ack=75297 Win=116224 Len=0 TSval=3520836659 TSecr=3786446107
    124 3.423235019    192.168.109.136       172.16.31.1           FTP-DATA 1514   FTP Data: 1448 bytes (PASV) (retr )
    125 3.423241444    172.16.31.1           192.168.109.136       TCP      66     40742 > 42282 [ACK] Seq=1 Ack=76745 Win=119168 Len=0 TSval=3520836659 TSecr=3786446107
    126 3.423357518    192.168.109.136       172.16.31.1           FTP-DATA 1514   FTP Data: 1448 bytes (PASV) (retr )
    127 3.423363804    172.16.31.1           192.168.109.136       TCP      66     40742 > 42282 [ACK] Seq=1 Ack=78193 Win=122112 Len=0 TSval=3520836659 TSecr=3786446107
    128 3.423481903    192.168.109.136       172.16.31.1           FTP-DATA 1514   FTP Data: 1448 bytes (PASV) (retr )
    129 3.423488608    172.16.31.1           192.168.109.136       TCP      66     40742 > 42282 [ACK] Seq=1 Ack=79641 Win=124928 Len=0 TSval=3520836659 TSecr=3786446107
    130 3.423604193    192.168.109.136       172.16.31.1           FTP-DATA 1514   FTP Data: 1448 bytes (PASV) (retr )
    131 3.423611037    172.16.31.1           192.168.109.136       TCP      66     40742 > 42282 [ACK] Seq=1 Ack=81089 Win=127872 Len=0 TSval=3520836659 TSecr=3786446107
    132 3.423726832    192.168.109.136       172.16.31.1           FTP-DATA 1514   FTP Data: 1448 bytes (PASV) (retr )
    133 3.423733257    172.16.31.1           192.168.109.136       TCP      66     40742 > 42282 [ACK] Seq=1 Ack=82537 Win=130816 Len=0 TSval=3520836659 TSecr=3786446107
    134 3.423851217    192.168.109.136       172.16.31.1           FTP-DATA 1514   FTP Data: 1448 bytes (PASV) (retr )
    135 3.423858131    172.16.31.1           192.168.109.136       TCP      66     40742 > 42282 [ACK] Seq=1 Ack=83985 Win=133632 Len=0 TSval=3520836659 TSecr=3786446107
    136 3.423973507    192.168.109.136       172.16.31.1           FTP-DATA 1514   FTP Data: 1448 bytes (PASV) (retr )
    137 3.423979932    172.16.31.1           192.168.109.136       TCP      66     40742 > 42282 [ACK] Seq=1 Ack=85433 Win=136576 Len=0 TSval=3520836660 TSecr=3786446108
    138 3.424096076    192.168.109.136       172.16.31.1           FTP-DATA 1514   FTP Data: 1448 bytes (PASV) (retr )
    139 3.424102431    172.16.31.1           192.168.109.136       TCP      66     40742 > 42282 [ACK] Seq=1 Ack=86881 Win=139392 Len=0 TSval=3520836660 TSecr=3786446108
    140 3.424221997    192.168.109.136       172.16.31.1           FTP-DATA 1514   FTP Data: 1448 bytes (PASV) (retr )
    141 3.424228632    172.16.31.1           192.168.109.136       TCP      66     40742 > 42282 [ACK] Seq=1 Ack=88329 Win=142336 Len=0 TSval=3520836660 TSecr=3786446108
    142 3.424342331    192.168.109.136       172.16.31.1           FTP-DATA 1514   FTP Data: 1448 bytes (PASV) (retr )
    143 3.424348827    172.16.31.1           192.168.109.136       TCP      66     40742 > 42282 [ACK] Seq=1 Ack=89777 Win=145280 Len=0 TSval=3520836660 TSecr=3786446108
    144 3.424465459    192.168.109.136       172.16.31.1           FTP-DATA 1514   FTP Data: 1448 bytes (PASV) (retr )
    145 3.424471675    172.16.31.1           192.168.109.136       TCP      66     40742 > 42282 [ACK] Seq=1 Ack=91225 Win=148096 Len=0 TSval=3520836660 TSecr=3786446108
    146 3.424589355    192.168.109.136       172.16.31.1           FTP-DATA 1514   FTP Data: 1448 bytes (PASV) (retr )
    147 3.424596269    172.16.31.1           192.168.109.136       TCP      66     40742 > 42282 [ACK] Seq=1 Ack=92673 Win=151040 Len=0 TSval=3520836660 TSecr=3786446108
    148 3.424711715    192.168.109.136       172.16.31.1           FTP-DATA 1514   FTP Data: 1448 bytes (PASV) (retr )
    149 3.424718210    172.16.31.1           192.168.109.136       TCP      66     40742 > 42282 [ACK] Seq=1 Ack=94121 Win=153984 Len=0 TSval=3520836660 TSecr=3786446108
    150 3.424834214    192.168.109.136       172.16.31.1           FTP-DATA 1514   FTP Data: 1448 bytes (PASV) (retr )
    151 3.424840430    172.16.31.1           192.168.109.136       TCP      66     40742 > 42282 [ACK] Seq=1 Ack=95569 Win=156800 Len=0 TSval=3520836660 TSecr=3786446108
...
  72251 9.309852329    192.168.109.136       172.16.31.1           FTP-DATA 1514   FTP Data: 1448 bytes (PASV) (retr )
  72252 9.309975387    192.168.109.136       172.16.31.1           FTP-DATA 1514   FTP Data: 1448 bytes (PASV) (retr )
  72253 9.309981183    172.16.31.1           192.168.109.136       TCP      66     40742 > 42282 [ACK] Seq=1 Ack=69351961 Win=2557312 Len=0 TSval=3520842546 TSecr=3786451974
  72254 9.310098794    192.168.109.136       172.16.31.1           FTP-DATA 1514   FTP Data: 1448 bytes (PASV) (retr )
  72255 9.310221642    192.168.109.136       172.16.31.1           FTP-DATA 1514   FTP Data: 1448 bytes (PASV) (retr )
  72256 9.310227439    172.16.31.1           192.168.109.136       TCP      66     40742 > 42282 [ACK] Seq=1 Ack=69354857 Win=2557312 Len=0 TSval=3520842546 TSecr=3786451974
  72257 9.310836723    192.168.109.136       172.16.31.1           FTP-DATA 1514   FTP Data: 1448 bytes (PASV) (retr )
  72258 9.310960339    192.168.109.136       172.16.31.1           FTP-DATA 1514   FTP Data: 1448 bytes (PASV) (retr )
  72259 9.310966206    172.16.31.1           192.168.109.136       TCP      66     40742 > 42282 [ACK] Seq=1 Ack=69357753 Win=2557312 Len=0 TSval=3520842547 TSecr=3786451975
  72260 9.311082559    192.168.109.136       172.16.31.1           FTP-DATA 1514   FTP Data: 1448 bytes (PASV) (retr )
  72261 9.311205617    192.168.109.136       172.16.31.1           FTP-DATA 1514   FTP Data: 1448 bytes (PASV) (retr )
  72262 9.311211204    172.16.31.1           192.168.109.136       TCP      66     40742 > 42282 [ACK] Seq=1 Ack=69360649 Win=2557312 Len=0 TSval=3520842547 TSecr=3786451975
  72263 9.311329024    192.168.109.136       172.16.31.1           FTP-DATA 1514   FTP Data: 1448 bytes (PASV) (retr )
  72264 9.311452292    192.168.109.136       172.16.31.1           FTP-DATA 1514   FTP Data: 1448 bytes (PASV) (retr )
  72265 9.311457879    172.16.31.1           192.168.109.136       TCP      66     40742 > 42282 [ACK] Seq=1 Ack=69363545 Win=2557312 Len=0 TSval=3520842547 TSecr=3786451975
  72266 9.311574582    192.168.109.136       172.16.31.1           FTP-DATA 1514   FTP Data: 1448 bytes (PASV) (retr )
  72267 9.311698687    192.168.109.136       172.16.31.1           FTP-DATA 1514   FTP Data: 1448 bytes (PASV) (retr )
  72268 9.311704344    172.16.31.1           192.168.109.136       TCP      66     40742 > 42282 [ACK] Seq=1 Ack=69366441 Win=2557312 Len=0 TSval=3520842547 TSecr=3786451975
  72269 9.311820767    192.168.109.136       172.16.31.1           FTP-DATA 1514   FTP Data: 1448 bytes (PASV) (retr )
  72270 9.312436895    192.168.109.136       172.16.31.1           FTP-DATA 1514   FTP Data: 1448 bytes (PASV) (retr )
  72271 9.312442482    172.16.31.1           192.168.109.136       TCP      66     40742 > 42282 [ACK] Seq=1 Ack=69369337 Win=2557312 Len=0 TSval=3520842548 TSecr=3786451975
  72272 9.312559464    192.168.109.136       172.16.31.1           FTP-DATA 1514   FTP Data: 1448 bytes (PASV) (retr )
  72273 9.312682383    192.168.109.136       172.16.31.1           FTP-DATA 1514   FTP Data: 1448 bytes (PASV) (retr )
  72274 9.312687830    172.16.31.1           192.168.109.136       TCP      66     40742 > 42282 [ACK] Seq=1 Ack=69372233 Win=2557312 Len=0 TSval=3520842548 TSecr=3786451976
  72275 9.312804812    192.168.109.136       172.16.31.1           FTP-DATA 1514   FTP Data: 1448 bytes (PASV) (retr )
  72276 9.312928918    192.168.109.136       172.16.31.1           FTP-DATA 1514   FTP Data: 1448 bytes (PASV) (retr )
  72277 9.312934575    172.16.31.1           192.168.109.136       TCP      66     40742 > 42282 [ACK] Seq=1 Ack=69375129 Win=2557312 Len=0 TSval=3520842549 TSecr=3786451976
  72278 9.313051417    192.168.109.136       172.16.31.1           FTP-DATA 1514   FTP Data: 1448 bytes (PASV) (retr )
  72279 9.313174754    192.168.109.136       172.16.31.1           FTP-DATA 1514   FTP Data: 1448 bytes (PASV) (retr )
  72280 9.313180132    172.16.31.1           192.168.109.136       TCP      66     40742 > 42282 [ACK] Seq=1 Ack=69378025 Win=2557312 Len=0 TSval=3520842549 TSecr=3786451976
  72281 9.313298371    192.168.109.136       172.16.31.1           FTP-DATA 1514   FTP Data: 1448 bytes (PASV) (retr )
  72282 9.313420940    192.168.109.136       172.16.31.1           FTP-DATA 1514   [TCP Previous segment not captured] FTP Data: 1448 bytes (PASV) (retr )
  72283 9.313429321    172.16.31.1           192.168.109.136       TCP      78     40742 > 42282 [ACK] Seq=1 Ack=69379473 Win=2557312 Len=0 TSval=3520842549 TSecr=3786451976 SLE=69380921 SRE=69382369
  72284 9.313543160    192.168.109.136       172.16.31.1           FTP-DATA 1514   FTP Data: 1448 bytes (PASV) (retr )
  72285 9.313550144    172.16.31.1           192.168.109.136       TCP      78     [TCP Dup ACK 72283#1] 40742 > 42282 [ACK] Seq=1 Ack=69379473 Win=2557312 Len=0 TSval=3520842549 TSecr=3786451976 SLE=69380921 SRE=69383817
  72286 9.313667266    192.168.109.136       172.16.31.1           FTP-DATA 1514   FTP Data: 1448 bytes (PASV) (retr )
  72287 9.313673691    172.16.31.1           192.168.109.136       TCP      78     [TCP Dup ACK 72283#2] 40742 > 42282 [ACK] Seq=1 Ack=69379473 Win=2557312 Len=0 TSval=3520842549 TSecr=3786451976 SLE=69380921 SRE=69385265
  72288 9.313789625    192.168.109.136       172.16.31.1           FTP-DATA 1514   FTP Data: 1448 bytes (PASV) (retr )
  72289 9.313839421    172.16.31.1           192.168.109.136       TCP      78     [TCP Dup ACK 72283#3] 40742 > 42282 [ACK] Seq=1 Ack=69379473 Win=2557312 Len=0 TSval=3520842549 TSecr=3786451976 SLE=69380921 SRE=69386713
  72290 9.313913312    192.168.109.136       172.16.31.1           FTP-DATA 1514   FTP Data: 1448 bytes (PASV) (retr )
  72291 9.313962619    172.16.31.1           192.168.109.136       TCP      78     [TCP Dup ACK 72283#4] 40742 > 42282 [ACK] Seq=1 Ack=69379473 Win=2557312 Len=0 TSval=3520842550 TSecr=3786451976 SLE=69380921 SRE=69388161
  72292 9.314035881    192.168.109.136       172.16.31.1           FTP-DATA 1514   FTP Data: 1448 bytes (PASV) (retr )
  72293 9.314084978    172.16.31.1           192.168.109.136       TCP      78     [TCP Dup ACK 72283#5] 40742 > 42282 [ACK] Seq=1 Ack=69379473 Win=2557312 Len=0 TSval=3520842550 TSecr=3786451976 SLE=69380921 SRE=69389609
  72294 9.314159637    192.168.109.136       172.16.31.1           FTP-DATA 1514   FTP Data: 1448 bytes (PASV) (retr )
  72295 9.314209084    172.16.31.1           192.168.109.136       TCP      78     [TCP Dup ACK 72283#6] 40742 > 42282 [ACK] Seq=1 Ack=69379473 Win=2557312 Len=0 TSval=3520842550 TSecr=3786451976 SLE=69380921 SRE=69391057
  72296 9.314282346    192.168.109.136       172.16.31.1           FTP-DATA 1514   FTP Data: 1448 bytes (PASV) (retr )
  72297 9.314331723    172.16.31.1           192.168.109.136       TCP      78     [TCP Dup ACK 72283#7] 40742 > 42282 [ACK] Seq=1 Ack=69379473 Win=2557312 Len=0 TSval=3520842550 TSecr=3786451976 SLE=69380921 SRE=69392505
  72298 9.314405055    192.168.109.136       172.16.31.1           FTP-DATA 1514   [TCP Previous segment not captured] FTP Data: 1448 bytes (PASV) (retr )
  72299 9.314454851    172.16.31.1           192.168.109.136       TCP      86     [TCP Dup ACK 72283#8] 40742 > 42282 [ACK] Seq=1 Ack=69379473 Win=2557312 Len=0 TSval=3520842550 TSecr=3786451976 SLE=69393953 SRE=69395401 SLE=69380921 SRE=69392505
  72300 9.314528811    192.168.109.136       172.16.31.1           FTP-DATA 1514   FTP Data: 1448 bytes (PASV) (retr )
  72301 9.314578048    172.16.31.1           192.168.109.136       TCP      86     [TCP Dup ACK 72283#9] 40742 > 42282 [ACK] Seq=1 Ack=69379473 Win=2557312 Len=0 TSval=3520842550 TSecr=3786451976 SLE=69393953 SRE=69396849 SLE=69380921 SRE=69392505
...
  72700 9.339997343    192.168.109.136       172.16.31.1           FTP-DATA 1514   FTP Data: 1448 bytes (PASV) (retr )
  72701 9.340045253    172.16.31.1           192.168.109.136       TCP      78     [TCP Dup ACK 72621#39] 40742 > 42282 [ACK] Seq=1 Ack=69483729 Win=2455552 Len=0 TSval=3520842576 TSecr=3786452000 SLE=69485177 SRE=69685001
  72702 9.340121030    192.168.109.136       172.16.31.1           FTP-DATA 1514   FTP Data: 1448 bytes (PASV) (retr )
  72703 9.340169219    172.16.31.1           192.168.109.136       TCP      78     [TCP Dup ACK 72621#40] 40742 > 42282 [ACK] Seq=1 Ack=69483729 Win=2455552 Len=0 TSval=3520842576 TSecr=3786452000 SLE=69485177 SRE=69686449
  72704 9.340244088    192.168.109.136       172.16.31.1           FTP-DATA 1514   FTP Data: 1448 bytes (PASV) (retr )
  72705 9.340292347    172.16.31.1           192.168.109.136       TCP      78     [TCP Dup ACK 72621#41] 40742 > 42282 [ACK] Seq=1 Ack=69483729 Win=2455552 Len=0 TSval=3520842576 TSecr=3786452000 SLE=69485177 SRE=69687897
  72706 9.340366726    192.168.109.136       172.16.31.1           FTP-DATA 1514   [TCP Fast Retransmission] FTP Data: 1448 bytes (PASV) (retr )
  72707 9.340375736    172.16.31.1           192.168.109.136       TCP      66     40742 > 42282 [ACK] Seq=1 Ack=69687897 Win=2417408 Len=0 TSval=3520842576 TSecr=3786452007
  72708 9.340489784    192.168.109.136       172.16.31.1           FTP-DATA 1514   FTP Data: 1448 bytes (PASV) (retr )
  72709 9.340612074    192.168.109.136       172.16.31.1           FTP-DATA 1514   FTP Data: 1448 bytes (PASV) (retr )
  72710 9.340618080    172.16.31.1           192.168.109.136       TCP      66     40742 > 42282 [ACK] Seq=1 Ack=69690793 Win=2434560 Len=0 TSval=3520842576 TSecr=3786452007
  72711 9.340734993    192.168.109.136       172.16.31.1           FTP-DATA 1514   FTP Data: 1448 bytes (PASV) (retr )
  72712 9.340859028    192.168.109.136       172.16.31.1           FTP-DATA 1514   FTP Data: 1448 bytes (PASV) (retr )
  72713 9.340864685    172.16.31.1           192.168.109.136       TCP      66     40742 > 42282 [ACK] Seq=1 Ack=69693689 Win=2486528 Len=0 TSval=3520842576 TSecr=3786452008
  72714 9.340981388    192.168.109.136       172.16.31.1           FTP-DATA 1514   FTP Data: 1448 bytes (PASV) (retr )
  72715 9.341104865    192.168.109.136       172.16.31.1           FTP-DATA 1514   FTP Data: 1448 bytes (PASV) (retr )
  72716 9.341112966    172.16.31.1           192.168.109.136       TCP      66     40742 > 42282 [ACK] Seq=1 Ack=69696585 Win=2520448 Len=0 TSval=3520842577 TSecr=3786452008
  72717 9.341228621    192.168.109.136       172.16.31.1           FTP-DATA 1514   FTP Data: 1448 bytes (PASV) (retr )
  72718 9.341351190    192.168.109.136       172.16.31.1           FTP-DATA 1514   FTP Data: 1448 bytes (PASV) (retr )
  72719 9.341376053    172.16.31.1           192.168.109.136       TCP      66     40742 > 42282 [ACK] Seq=1 Ack=69699481 Win=2554368 Len=0 TSval=3520842577 TSecr=3786452009
  72720 9.341463493    192.168.109.136       172.16.31.1           FTP-DATA 1514   FTP Data: 1448 bytes (PASV) (retr )
  72721 9.341597586    192.168.109.136       172.16.31.1           FTP-DATA 1514   FTP Data: 1448 bytes (PASV) (retr )
  72722 9.341605338    172.16.31.1           192.168.109.136       TCP      66     40742 > 42282 [ACK] Seq=1 Ack=69702377 Win=2556416 Len=0 TSval=3520842577 TSecr=3786452009
  72723 9.341720713    192.168.109.136       172.16.31.1           FTP-DATA 1514   FTP Data: 1448 bytes (PASV) (retr )
  72724 9.341842444    192.168.109.136       172.16.31.1           FTP-DATA 1514   FTP Data: 1448 bytes (PASV) (retr )
  72725 9.341965083    192.168.109.136       172.16.31.1           FTP-DATA 1514   FTP Data: 1448 bytes (PASV) (retr )
  72726 9.342089329    192.168.109.136       172.16.31.1           FTP-DATA 1514   FTP Data: 1448 bytes (PASV) (retr )
  72727 9.342211549    192.168.109.136       172.16.31.1           FTP-DATA 1514   FTP Data: 1448 bytes (PASV) (retr )
  72728 9.342334746    192.168.109.136       172.16.31.1           FTP-DATA 1514   FTP Data: 1448 bytes (PASV) (retr )
  72729 9.342458014    192.168.109.136       172.16.31.1           FTP-DATA 1514   FTP Data: 1448 bytes (PASV) (retr )
  72730 9.342581142    192.168.109.136       172.16.31.1           FTP-DATA 1514   FTP Data: 1448 bytes (PASV) (retr )
  72731 9.342703711    192.168.109.136       172.16.31.1           FTP-DATA 1514   FTP Data: 1448 bytes (PASV) (retr )
  72732 9.342827537    192.168.109.136       172.16.31.1           FTP-DATA 1514   FTP Data: 1448 bytes (PASV) (retr )
  72733 9.342949896    192.168.109.136       172.16.31.1           FTP-DATA 1514   FTP Data: 1448 bytes (PASV) (retr )
  72734 9.343072605    192.168.109.136       172.16.31.1           FTP-DATA 1514   FTP Data: 1448 bytes (PASV) (retr )
  72735 9.343196501    192.168.109.136       172.16.31.1           FTP-DATA 1514   FTP Data: 1448 bytes (PASV) (retr )
  72736 9.343320956    192.168.109.136       172.16.31.1           FTP-DATA 1514   FTP Data: 1448 bytes (PASV) (retr )
  72737 9.343442059    192.168.109.136       172.16.31.1           FTP-DATA 1514   FTP Data: 1448 bytes (PASV) (retr )
  72738 9.343565675    192.168.109.136       172.16.31.1           FTP-DATA 1514   FTP Data: 1448 bytes (PASV) (retr )
  72739 9.343618195    172.16.31.1           192.168.109.136       TCP      66     40742 > 42282 [ACK] Seq=1 Ack=69725545 Win=2540544 Len=0 TSval=3520842579 TSecr=3786452009
  72740 9.343690130    192.168.109.136       172.16.31.1           FTP-DATA 1514   FTP Data: 1448 bytes (PASV) (retr )
  72741 9.343812839    192.168.109.136       172.16.31.1           FTP-DATA 1514   FTP Data: 1448 bytes (PASV) (retr )
  72742 9.343818915    172.16.31.1           192.168.109.136       TCP      66     40742 > 42282 [ACK] Seq=1 Ack=69728441 Win=2557312 Len=0 TSval=3520842579 TSecr=3786452012
  72743 9.343934151    192.168.109.136       172.16.31.1           FTP-DATA 1514   FTP Data: 1448 bytes (PASV) (retr )
  72744 9.344058606    192.168.109.136       172.16.31.1           FTP-DATA 1514   FTP Data: 1448 bytes (PASV) (retr )
  72745 9.344064682    172.16.31.1           192.168.109.136       TCP      66     40742 > 42282 [ACK] Seq=1 Ack=69731337 Win=2557312 Len=0 TSval=3520842580 TSecr=3786452012
  72746 9.344180756    192.168.109.136       172.16.31.1           FTP-DATA 1514   FTP Data: 1448 bytes (PASV) (retr )
  72747 9.344304023    192.168.109.136       172.16.31.1           FTP-DATA 1514   FTP Data: 1448 bytes (PASV) (retr )
  72748 9.344309471    172.16.31.1           192.168.109.136       TCP      66     40742 > 42282 [ACK] Seq=1 Ack=69734233 Win=2557312 Len=0 TSval=3520842580 TSecr=3786452013
  72749 9.344427081    192.168.109.136       172.16.31.1           FTP-DATA 1514   FTP Data: 1448 bytes (PASV) (retr )
  72750 9.344550558    192.168.109.136       172.16.31.1           FTP-DATA 1514   FTP Data: 1448 bytes (PASV) (retr )
  72751 9.344556285    172.16.31.1           192.168.109.136       TCP      66     40742 > 42282 [ACK] Seq=1 Ack=69737129 Win=2557312 Len=0 TSval=3520842580 TSecr=3786452013
...
  91751 11.163992737   192.168.109.136       172.16.31.1           FTP-DATA 1514   FTP Data: 1448 bytes (PASV) (retr )
  91752 11.164115027   192.168.109.136       172.16.31.1           FTP-DATA 1514   FTP Data: 1448 bytes (PASV) (retr )
  91753 11.164120684   172.16.31.1           192.168.109.136       TCP      66     40742 > 42282 [ACK] Seq=1 Ack=88077497 Win=2557312 Len=0 TSval=3520844400 TSecr=3786453829
  91754 11.164237387   192.168.109.136       172.16.31.1           FTP-DATA 1514   FTP Data: 1448 bytes (PASV) (retr )
  91755 11.164361562   192.168.109.136       172.16.31.1           FTP-DATA 1514   FTP Data: 1448 bytes (PASV) (retr )
  91756 11.164367149   172.16.31.1           192.168.109.136       TCP      66     40742 > 42282 [ACK] Seq=1 Ack=88080393 Win=2557312 Len=0 TSval=3520844400 TSecr=3786453829
  91757 11.164483712   192.168.109.136       172.16.31.1           FTP-DATA 1514   FTP Data: 1448 bytes (PASV) (retr )
  91758 11.164606910   192.168.109.136       172.16.31.1           FTP-DATA 1514   FTP Data: 1448 bytes (PASV) (retr )
  91759 11.164612427   172.16.31.1           192.168.109.136       TCP      66     40742 > 42282 [ACK] Seq=1 Ack=88083289 Win=2557312 Len=0 TSval=3520844400 TSecr=3786453829
  91760 11.164730387   192.168.109.136       172.16.31.1           FTP-DATA 1514   FTP Data: 1448 bytes (PASV) (retr )
  91761 11.164853445   192.168.109.136       172.16.31.1           FTP-DATA 1514   FTP Data: 1448 bytes (PASV) (retr )
  91762 11.164858822   172.16.31.1           192.168.109.136       TCP      66     40742 > 42282 [ACK] Seq=1 Ack=88086185 Win=2557312 Len=0 TSval=3520844400 TSecr=3786453830
  91763 11.164975804   192.168.109.136       172.16.31.1           FTP-DATA 1514   FTP Data: 1448 bytes (PASV) (retr )
  91764 11.165099910   192.168.109.136       172.16.31.1           FTP-DATA 1514   FTP Data: 1448 bytes (PASV) (retr )
  91765 11.165105637   172.16.31.1           192.168.109.136       TCP      66     40742 > 42282 [ACK] Seq=1 Ack=88089081 Win=2557312 Len=0 TSval=3520844401 TSecr=3786453830
  91766 11.165222270   192.168.109.136       172.16.31.1           FTP-DATA 1514   FTP Data: 1448 bytes (PASV) (retr )
  91767 11.165345328   192.168.109.136       172.16.31.1           FTP-DATA 1514   FTP Data: 1448 bytes (PASV) (retr )
  91768 11.165350915   172.16.31.1           192.168.109.136       TCP      66     40742 > 42282 [ACK] Seq=1 Ack=88091977 Win=2557312 Len=0 TSval=3520844401 TSecr=3786453830
  91769 11.165714362   192.168.109.136       172.16.31.1           FTP-DATA 1514   FTP Data: 1448 bytes (PASV) (retr )
  91770 11.165837350   192.168.109.136       172.16.31.1           FTP-DATA 1514   FTP Data: 1448 bytes (PASV) (retr )
  91771 11.165843077   172.16.31.1           192.168.109.136       TCP      66     40742 > 42282 [ACK] Seq=1 Ack=88094873 Win=2557312 Len=0 TSval=3520844401 TSecr=3786453831
  91772 11.165960687   192.168.109.136       172.16.31.1           FTP-DATA 1514   FTP Data: 1448 bytes (PASV) (retr )
  91773 11.166083745   192.168.109.136       172.16.31.1           FTP-DATA 1514   FTP Data: 1448 bytes (PASV) (retr )
  91774 11.166089751   172.16.31.1           192.168.109.136       TCP      66     40742 > 42282 [ACK] Seq=1 Ack=88097769 Win=2557312 Len=0 TSval=3520844402 TSecr=3786453831
  91775 11.166206733   192.168.109.136       172.16.31.1           FTP-DATA 1514   FTP Data: 1448 bytes (PASV) (retr )
  91776 11.166330210   192.168.109.136       172.16.31.1           FTP-DATA 1514   FTP Data: 1448 bytes (PASV) (retr )
  91777 11.166335798   172.16.31.1           192.168.109.136       TCP      66     40742 > 42282 [ACK] Seq=1 Ack=88100665 Win=2557312 Len=0 TSval=3520844402 TSecr=3786453831
  91778 11.166452570   192.168.109.136       172.16.31.1           FTP-DATA 1514   FTP Data: 1448 bytes (PASV) (retr )
  91779 11.166822093   192.168.109.136       172.16.31.1           FTP-DATA 1514   FTP Data: 1448 bytes (PASV) (retr )
  91780 11.166827610   172.16.31.1           192.168.109.136       TCP      66     40742 > 42282 [ACK] Seq=1 Ack=88103561 Win=2557312 Len=0 TSval=3520844402 TSecr=3786453831
  91781 11.166944523   192.168.109.136       172.16.31.1           FTP-DATA 1514   FTP Data: 1448 bytes (PASV) (retr )
  91782 11.167068488   192.168.109.136       172.16.31.1           FTP-DATA 1514   FTP Data: 1448 bytes (PASV) (retr )
  91783 11.167074006   172.16.31.1           192.168.109.136       TCP      66     40742 > 42282 [ACK] Seq=1 Ack=88106457 Win=2557312 Len=0 TSval=3520844403 TSecr=3786453832
  91784 11.167190988   192.168.109.136       172.16.31.1           FTP-DATA 1514   FTP Data: 1448 bytes (PASV) (retr )
  91785 11.167314115   192.168.109.136       172.16.31.1           FTP-DATA 1514   FTP Data: 1448 bytes (PASV) (retr )
  91786 11.167319912   172.16.31.1           192.168.109.136       TCP      66     40742 > 42282 [ACK] Seq=1 Ack=88109353 Win=2557312 Len=0 TSval=3520844403 TSecr=3786453832
  91787 11.167436475   192.168.109.136       172.16.31.1           FTP-DATA 1514   FTP Data: 1448 bytes (PASV) (retr )
  91788 11.167560301   192.168.109.136       172.16.31.1           FTP-DATA 1514   FTP Data: 1448 bytes (PASV) (retr )
  91789 11.167565958   172.16.31.1           192.168.109.136       TCP      66     40742 > 42282 [ACK] Seq=1 Ack=88112249 Win=2557312 Len=0 TSval=3520844403 TSecr=3786453832
  91790 11.167929405   192.168.109.136       172.16.31.1           FTP-DATA 1514   FTP Data: 1448 bytes (PASV) (retr )
  91791 11.168052463   192.168.109.136       172.16.31.1           FTP-DATA 1514   FTP Data: 1448 bytes (PASV) (retr )
  91792 11.168058051   172.16.31.1           192.168.109.136       TCP      66     40742 > 42282 [ACK] Seq=1 Ack=88115145 Win=2557312 Len=0 TSval=3520844404 TSecr=3786453833
  91793 11.168174963   192.168.109.136       172.16.31.1           FTP-DATA 1514   FTP Data: 1448 bytes (PASV) (retr )
  91794 11.168298929   192.168.109.136       172.16.31.1           FTP-DATA 1514   FTP Data: 1448 bytes (PASV) (retr )
  91795 11.168304516   172.16.31.1           192.168.109.136       TCP      66     40742 > 42282 [ACK] Seq=1 Ack=88118041 Win=2557312 Len=0 TSval=3520844404 TSecr=3786453833
  91796 11.168421288   192.168.109.136       172.16.31.1           FTP-DATA 1514   FTP Data: 1448 bytes (PASV) (retr )
  91797 11.168544276   192.168.109.136       172.16.31.1           FTP-DATA 1514   FTP Data: 1448 bytes (PASV) (retr )
  91798 11.168549863   172.16.31.1           192.168.109.136       TCP      66     40742 > 42282 [ACK] Seq=1 Ack=88120937 Win=2557312 Len=0 TSval=3520844404 TSecr=3786453833
  91799 11.168668242   192.168.109.136       172.16.31.1           FTP-DATA 1514   FTP Data: 1448 bytes (PASV) (retr )
  91800 11.168735568   192.168.109.136       172.16.31.1           FTP-DATA 866    FTP Data: 800 bytes (PASV) (retr )
  91801 11.168747161   172.16.31.1           192.168.109.136       TCP      66     40742 > 42282 [ACK] Seq=1 Ack=88123186 Win=2557312 Len=0 TSval=3520844404 TSecr=3786453833
  91802 11.173670668   192.168.109.136       172.16.31.1           FTP      90     Response: 226 Transfer complete.
  91803 11.173679048   172.16.31.1           192.168.109.136       TCP      66     32830 > 21 [ACK] Seq=46 Ack=247 Win=64256 Len=0 TSval=3520844409 TSecr=3786453854
  91804 12.027275256   Cisco_3a:fa:85        Spanning-tree-(for-bridges)_00 STP      60     Conf. Root = 32768/31/fc:fb:fb:3a:fa:80  Cost = 0  Port = 0x8005
  91805 12.715257424   172.16.31.1           192.168.109.136       FTP      70     Request: quit
  91806 12.729667569   192.168.109.136       172.16.31.1           TCP      66     21 > 32830 [ACK] Seq=247 Ack=50 Win=65280 Len=0 TSval=3786455401 TSecr=3520845951
  91807 12.729684540   172.16.31.1           192.168.109.136       FTP      67     Request: 
  91808 12.743954097   192.168.109.136       172.16.31.1           TCP      66     21 > 32830 [ACK] Seq=247 Ack=51 Win=65280 Len=0 TSval=3786455415 TSecr=3520845965
  91809 12.743959475   192.168.109.136       172.16.31.1           FTP      80     Response: 221 Goodbye.
  91810 12.743965900   172.16.31.1           192.168.109.136       TCP      66     32830 > 21 [ACK] Seq=51 Ack=261 Win=64256 Len=0 TSval=3520845980 TSecr=3786455415
  91811 12.743991182   172.16.31.1           192.168.109.136       TCP      66     32830 > 21 [FIN, ACK] Seq=51 Ack=261 Win=64256 Len=0 TSval=3520845980 TSecr=3786455415
  91812 12.744006268   172.16.31.1           192.168.109.136       TCP      66     40742 > 42282 [FIN, ACK] Seq=1 Ack=88123186 Win=2558464 Len=0 TSval=3520845980 TSecr=3786453833
  91813 12.745069860   192.168.109.136       172.16.31.1           TCP      66     21 > 32830 [FIN, ACK] Seq=261 Ack=51 Win=65280 Len=0 TSval=3786455415 TSecr=3520845965
  91814 12.745082641   172.16.31.1           192.168.109.136       TCP      66     32830 > 21 [ACK] Seq=52 Ack=262 Win=64256 Len=0 TSval=3520845981 TSecr=3786455415
  91815 12.758368223   192.168.109.136       172.16.31.1           TCP      66     42282 > 40742 [ACK] Seq=88123186 Ack=2 Win=65280 Len=0 TSval=3786455429 TSecr=3520845980
  91816 12.759107130   192.168.109.136       172.16.31.1           TCP      66     21 > 32830 [ACK] Seq=262 Ack=52 Win=65280 Len=0 TSval=3786455430 TSecr=3520845980
  91817 14.032138840   Cisco_3a:fa:85        Spanning-tree-(for-bridges)_00 STP      60     Conf. Root = 32768/31/fc:fb:fb:3a:fa:80  Cost = 0  Port = 0x8005
  91818 16.037038733   Cisco_3a:fa:85        Spanning-tree-(for-bridges)_00 STP      60     Conf. Root = 32768/31/fc:fb:fb:3a:fa:80  Cost = 0  Port = 0x8005
  91819 18.041942179   Cisco_3a:fa:85        Spanning-tree-(for-bridges)_00 STP      60     Conf. Root = 32768/31/fc:fb:fb:3a:fa:80  Cost = 0  Port = 0x8005
  91820 20.046882911   Cisco_3a:fa:85        Spanning-tree-(for-bridges)_00 STP      60     Conf. Root = 32768/31/fc:fb:fb:3a:fa:80  Cost = 0  Port = 0x8005
  91821 20.659378497   Cisco_3a:fa:85        Cisco_3a:fa:85        LOOP     60     Reply
  91822 22.051711403   Cisco_3a:fa:85        Spanning-tree-(for-bridges)_00 STP      60     Conf. Root = 32768/31/fc:fb:fb:3a:fa:80  Cost = 0  Port = 0x8005
  91823 24.056746613   Cisco_3a:fa:85        Spanning-tree-(for-bridges)_00 STP      60     Conf. Root = 32768/31/fc:fb:fb:3a:fa:80  Cost = 0  Port = 0x8005
  91824 26.061505807   Cisco_3a:fa:85        Spanning-tree-(for-bridges)_00 STP      60     Conf. Root = 32768/31/fc:fb:fb:3a:fa:80  Cost = 0  Port = 0x8005
  91825 28.066393010   Cisco_3a:fa:85        Spanning-tree-(for-bridges)_00 STP      60     Conf. Root = 32768/31/fc:fb:fb:3a:fa:80  Cost = 0  Port = 0x8005
