No.     Time           Source                Destination           Protocol Length Info
      1 0.000000000    Cisco_3a:fa:83        Spanning-tree-(for-bridges)_00 STP      60     Conf. Root = 32768/30/fc:fb:fb:3a:fa:80  Cost = 0  Port = 0x8003
      2 1.999887991    Cisco_3a:fa:83        Spanning-tree-(for-bridges)_00 STP      60     Conf. Root = 32768/30/fc:fb:fb:3a:fa:80  Cost = 0  Port = 0x8003
      3 4.004907874    Cisco_3a:fa:83        Spanning-tree-(for-bridges)_00 STP      60     Conf. Root = 32768/30/fc:fb:fb:3a:fa:80  Cost = 0  Port = 0x8003
      4 6.014720009    Cisco_3a:fa:83        Spanning-tree-(for-bridges)_00 STP      60     Conf. Root = 32768/30/fc:fb:fb:3a:fa:80  Cost = 0  Port = 0x8003
      5 6.320102034    Cisco_3a:fa:83        Cisco_3a:fa:83        LOOP     60     Reply
      6 8.014559600    Cisco_3a:fa:83        Spanning-tree-(for-bridges)_00 STP      60     Conf. Root = 32768/30/fc:fb:fb:3a:fa:80  Cost = 0  Port = 0x8003
      7 9.784914743    Cisco_3a:fa:83        CDP/VTP/DTP/PAgP/UDLD CDP      435    Device ID: tux-sw3  Port ID: FastEthernet0/1  
      8 10.019439520   Cisco_3a:fa:83        Spanning-tree-(for-bridges)_00 STP      60     Conf. Root = 32768/30/fc:fb:fb:3a:fa:80  Cost = 0  Port = 0x8003
      9 12.029309065   Cisco_3a:fa:83        Spanning-tree-(for-bridges)_00 STP      60     Conf. Root = 32768/30/fc:fb:fb:3a:fa:80  Cost = 0  Port = 0x8003
     10 14.029218847   Cisco_3a:fa:83        Spanning-tree-(for-bridges)_00 STP      60     Conf. Root = 32768/30/fc:fb:fb:3a:fa:80  Cost = 0  Port = 0x8003
     11 16.034105821   Cisco_3a:fa:83        Spanning-tree-(for-bridges)_00 STP      60     Conf. Root = 32768/30/fc:fb:fb:3a:fa:80  Cost = 0  Port = 0x8003
     12 16.328092349   Cisco_3a:fa:83        Cisco_3a:fa:83        LOOP     60     Reply
     13 18.044047442   Cisco_3a:fa:83        Spanning-tree-(for-bridges)_00 STP      60     Conf. Root = 32768/30/fc:fb:fb:3a:fa:80  Cost = 0  Port = 0x8003
     14 20.043855535   Cisco_3a:fa:83        Spanning-tree-(for-bridges)_00 STP      60     Conf. Root = 32768/30/fc:fb:fb:3a:fa:80  Cost = 0  Port = 0x8003
     15 22.048756756   Cisco_3a:fa:83        Spanning-tree-(for-bridges)_00 STP      60     Conf. Root = 32768/30/fc:fb:fb:3a:fa:80  Cost = 0  Port = 0x8003
     16 24.058594383   Cisco_3a:fa:83        Spanning-tree-(for-bridges)_00 STP      60     Conf. Root = 32768/30/fc:fb:fb:3a:fa:80  Cost = 0  Port = 0x8003
     17 26.058566115   Cisco_3a:fa:83        Spanning-tree-(for-bridges)_00 STP      60     Conf. Root = 32768/30/fc:fb:fb:3a:fa:80  Cost = 0  Port = 0x8003
     18 26.335382292   Cisco_3a:fa:83        Cisco_3a:fa:83        LOOP     60     Reply
     19 28.063425502   Cisco_3a:fa:83        Spanning-tree-(for-bridges)_00 STP      60     Conf. Root = 32768/30/fc:fb:fb:3a:fa:80  Cost = 0  Port = 0x8003
     20 29.438866074   172.16.30.1           172.16.1.1            DNS      76     Standard query 0x7d25 A netlab1.fe.up.pt
     21 29.440433460   172.16.1.1            172.16.30.1           DNS      340    Standard query response 0x7d25 A netlab1.fe.up.pt A 192.168.109.136 NS ns1.up.pt NS ns2.up.pt NS ns4.up.pt NS ns3.up.pt A 193.137.55.30 AAAA 2001:690:2200:a10::30 A 193.137.55.31 AAAA 2001:690:2200:a10::31 A 193.137.55.32 AAAA 2001:690:2200:a10::32 A 193.137.55.33 AAAA 2001:690:2200:a10::33
     22 29.440531238   172.16.30.1           192.168.109.136       TCP      74     46772 -> 21 [SYN] Seq=0 Win=64240 Len=0 MSS=1460 SACK_PERM=1 TSval=1800608927 TSecr=0 WS=128
     23 29.441946229   192.168.109.136       172.16.30.1           TCP      74     21 -> 46772 [SYN, ACK] Seq=0 Ack=1 Win=65160 Len=0 MSS=1460 SACK_PERM=1 TSval=3784845446 TSecr=1800608927 WS=128
     24 29.441964388   172.16.30.1           192.168.109.136       TCP      66     46772 -> 21 [ACK] Seq=1 Ack=1 Win=64256 Len=0 TSval=1800608928 TSecr=3784845446
     25 29.444207840   192.168.109.136       172.16.30.1           FTP      100    Response: 220 Welcome to netlab-FTP server
     26 29.444217688   172.16.30.1           192.168.109.136       TCP      66     46772 -> 21 [ACK] Seq=1 Ack=35 Win=64256 Len=0 TSval=1800608931 TSecr=3784845448
     27 29.444238291   172.16.30.1           192.168.109.136       FTP      71     Request: user 
     28 29.445198613   192.168.109.136       172.16.30.1           TCP      66     21 -> 46772 [ACK] Seq=35 Ack=6 Win=65280 Len=0 TSval=3784845449 TSecr=1800608931
     29 29.445206296   172.16.30.1           192.168.109.136       FTP      71     Request: rcom
     30 29.446265444   192.168.109.136       172.16.30.1           TCP      66     21 -> 46772 [ACK] Seq=35 Ack=11 Win=65280 Len=0 TSval=3784845450 TSecr=1800608932
     31 29.446330745   192.168.109.136       172.16.30.1           FTP      100    Response: 331 Please specify the password.
     32 29.446348346   172.16.30.1           192.168.109.136       FTP      71     Request: pass 
     33 29.447267391   192.168.109.136       172.16.30.1           TCP      66     21 -> 46772 [ACK] Seq=69 Ack=16 Win=65280 Len=0 TSval=3784845451 TSecr=1800608933
     34 29.447274515   172.16.30.1           192.168.109.136       FTP      71     Request: rcom
     35 29.448129656   192.168.109.136       172.16.30.1           TCP      66     21 -> 46772 [ACK] Seq=69 Ack=21 Win=65280 Len=0 TSval=3784845452 TSecr=1800608934
     36 29.457698585   192.168.109.136       172.16.30.1           FTP      89     Response: 230 Login successful.
     37 29.457768636   172.16.30.1           192.168.109.136       FTP      71     Request: pasv
     38 29.458956642   192.168.109.136       172.16.30.1           TCP      66     21 -> 46772 [ACK] Seq=92 Ack=26 Win=65280 Len=0 TSval=3784845463 TSecr=1800608944
     39 29.459156948   192.168.109.136       172.16.30.1           FTP      120    Response: 227 Entering Passive Mode (192,168,109,136,162,113).
     40 29.459201926   172.16.30.1           192.168.109.136       TCP      74     43196 -> 41585 [SYN] Seq=0 Win=64240 Len=0 MSS=1460 SACK_PERM=1 TSval=1800608946 TSecr=0 WS=128
     41 29.460069219   192.168.109.136       172.16.30.1           TCP      74     41585 -> 43196 [SYN, ACK] Seq=0 Ack=1 Win=65160 Len=0 MSS=1460 SACK_PERM=1 TSval=3784845464 TSecr=1800608946 WS=128
     42 29.460082140   172.16.30.1           192.168.109.136       TCP      66     43196 -> 41585 [ACK] Seq=1 Ack=1 Win=64256 Len=0 TSval=1800608946 TSecr=3784845464
     43 29.460097994   172.16.30.1           192.168.109.136       FTP      71     Request: retr 
     44 29.460954042   192.168.109.136       172.16.30.1           TCP      66     21 -> 46772 [ACK] Seq=146 Ack=31 Win=65280 Len=0 TSval=3784845465 TSecr=1800608946
     45 29.460961515   172.16.30.1           192.168.109.136       FTP      81     Request: files/pic2.png
     46 29.461789907   192.168.109.136       172.16.30.1           TCP      66     21 -> 46772 [ACK] Seq=146 Ack=46 Win=65280 Len=0 TSval=3784845466 TSecr=1800608947
     47 29.462443275   192.168.109.136       172.16.30.1           FTP-DATA 1514   FTP Data: 1448 bytes (PASV) (retr )
     48 29.462450608   172.16.30.1           192.168.109.136       TCP      66     43196 -> 41585 [ACK] Seq=1 Ack=1449 Win=64128 Len=0 TSval=1800608949 TSecr=3784845466
     49 29.462564939   192.168.109.136       172.16.30.1           FTP-DATA 1514   FTP Data: 1448 bytes (PASV) (retr )
     50 29.462571993   172.16.30.1           192.168.109.136       TCP      66     43196 -> 41585 [ACK] Seq=1 Ack=2897 Win=63488 Len=0 TSval=1800608949 TSecr=3784845466
     51 29.462688698   192.168.109.136       172.16.30.1           FTP-DATA 1514   FTP Data: 1448 bytes (PASV) (retr )
     52 29.462694914   172.16.30.1           192.168.109.136       TCP      66     43196 -> 41585 [ACK] Seq=1 Ack=4345 Win=62464 Len=0 TSval=1800608949 TSecr=3784845466
     53 29.462811410   192.168.109.136       172.16.30.1           FTP-DATA 1514   FTP Data: 1448 bytes (PASV) (retr )
     54 29.462817486   172.16.30.1           192.168.109.136       TCP      66     43196 -> 41585 [ACK] Seq=1 Ack=5793 Win=61440 Len=0 TSval=1800608949 TSecr=3784845466
     55 29.462947462   192.168.109.136       172.16.30.1           FTP-DATA 1514   FTP Data: 1448 bytes (PASV) (retr )
     56 29.462953398   172.16.30.1           192.168.109.136       TCP      66     43196 -> 41585 [ACK] Seq=1 Ack=7241 Win=60544 Len=0 TSval=1800608949 TSecr=3784845466
     57 29.462956262   192.168.109.136       172.16.30.1           FTP      143    Response: 150 Opening BINARY mode data connection for files/pic2.png (1965631 bytes).
     58 29.463079672   192.168.109.136       172.16.30.1           FTP-DATA 1514   FTP Data: 1448 bytes (PASV) (retr )
     59 29.463087424   172.16.30.1           192.168.109.136       TCP      66     43196 -> 41585 [ACK] Seq=1 Ack=8689 Win=59520 Len=0 TSval=1800608949 TSecr=3784845466
     60 29.463198193   192.168.109.136       172.16.30.1           FTP-DATA 1514   FTP Data: 1448 bytes (PASV) (retr )
     61 29.463204479   172.16.30.1           192.168.109.136       TCP      66     43196 -> 41585 [ACK] Seq=1 Ack=10137 Win=58496 Len=0 TSval=1800608950 TSecr=3784845466
     62 29.463460029   192.168.109.136       172.16.30.1           FTP-DATA 1514   FTP Data: 1448 bytes (PASV) (retr )
     63 29.463465966   172.16.30.1           192.168.109.136       TCP      66     43196 -> 41585 [ACK] Seq=1 Ack=11585 Win=57472 Len=0 TSval=1800608950 TSecr=3784845466
     64 29.463584138   192.168.109.136       172.16.30.1           FTP-DATA 1514   FTP Data: 1448 bytes (PASV) (retr )
     65 29.463591820   172.16.30.1           192.168.109.136       TCP      66     43196 -> 41585 [ACK] Seq=1 Ack=13033 Win=56576 Len=0 TSval=1800608950 TSecr=3784845466
     66 29.463707059   192.168.109.136       172.16.30.1           FTP-DATA 1514   FTP Data: 1448 bytes (PASV) (retr )
     67 29.463713764   172.16.30.1           192.168.109.136       TCP      66     43196 -> 41585 [ACK] Seq=1 Ack=14481 Win=64128 Len=0 TSval=1800608950 TSecr=3784845466
     68 29.463830748   192.168.109.136       172.16.30.1           FTP-DATA 1514   FTP Data: 1448 bytes (PASV) (retr )
     69 29.463837104   172.16.30.1           192.168.109.136       TCP      66     43196 -> 41585 [ACK] Seq=1 Ack=15929 Win=64128 Len=0 TSval=1800608950 TSecr=3784845467
     70 29.463954228   192.168.109.136       172.16.30.1           FTP-DATA 1514   FTP Data: 1448 bytes (PASV) (retr )
     71 29.463960514   172.16.30.1           192.168.109.136       TCP      66     43196 -> 41585 [ACK] Seq=1 Ack=17377 Win=64128 Len=0 TSval=1800608950 TSecr=3784845467
     72 29.464076312   192.168.109.136       172.16.30.1           FTP-DATA 1514   FTP Data: 1448 bytes (PASV) (retr )
     73 29.464082597   172.16.30.1           192.168.109.136       TCP      66     43196 -> 41585 [ACK] Seq=1 Ack=18825 Win=64128 Len=0 TSval=1800608950 TSecr=3784845467
     74 29.464198884   192.168.109.136       172.16.30.1           FTP-DATA 1514   FTP Data: 1448 bytes (PASV) (retr )
     75 29.464205030   172.16.30.1           192.168.109.136       TCP      66     43196 -> 41585 [ACK] Seq=1 Ack=20273 Win=64128 Len=0 TSval=1800608951 TSecr=3784845467
     76 29.464322713   192.168.109.136       172.16.30.1           FTP-DATA 1514   FTP Data: 1448 bytes (PASV) (retr )
     77 29.464328929   172.16.30.1           192.168.109.136       TCP      66     43196 -> 41585 [ACK] Seq=1 Ack=21721 Win=64128 Len=0 TSval=1800608951 TSecr=3784845467
     78 29.464445424   192.168.109.136       172.16.30.1           FTP-DATA 1514   FTP Data: 1448 bytes (PASV) (retr )
     79 29.464451990   172.16.30.1           192.168.109.136       TCP      66     43196 -> 41585 [ACK] Seq=1 Ack=23169 Win=64128 Len=0 TSval=1800608951 TSecr=3784845467
     80 29.464569114   192.168.109.136       172.16.30.1           FTP-DATA 1514   FTP Data: 1448 bytes (PASV) (retr )
     81 29.464692594   192.168.109.136       172.16.30.1           FTP-DATA 1514   FTP Data: 1448 bytes (PASV) (retr )
     82 29.464698950   172.16.30.1           192.168.109.136       TCP      66     43196 -> 41585 [ACK] Seq=1 Ack=26065 Win=64128 Len=0 TSval=1800608951 TSecr=3784845467
     83 29.464814537   192.168.109.136       172.16.30.1           FTP-DATA 1514   FTP Data: 1448 bytes (PASV) (retr )
     84 29.464937947   192.168.109.136       172.16.30.1           FTP-DATA 1514   FTP Data: 1448 bytes (PASV) (retr )
     85 29.464943884   172.16.30.1           192.168.109.136       TCP      66     43196 -> 41585 [ACK] Seq=1 Ack=28961 Win=64128 Len=0 TSval=1800608951 TSecr=3784845468
     86 29.465061148   192.168.109.136       172.16.30.1           FTP-DATA 1514   FTP Data: 1448 bytes (PASV) (retr )
     87 29.465186095   192.168.109.136       172.16.30.1           FTP-DATA 1514   FTP Data: 1448 bytes (PASV) (retr )
     88 29.465192171   172.16.30.1           192.168.109.136       TCP      66     43196 -> 41585 [ACK] Seq=1 Ack=31857 Win=64128 Len=0 TSval=1800608952 TSecr=3784845468
     89 29.465306432   192.168.109.136       172.16.30.1           FTP-DATA 1514   FTP Data: 1448 bytes (PASV) (retr )
     90 29.465431169   192.168.109.136       172.16.30.1           FTP-DATA 1514   FTP Data: 1448 bytes (PASV) (retr )
     91 29.465437525   172.16.30.1           192.168.109.136       TCP      66     43196 -> 41585 [ACK] Seq=1 Ack=34753 Win=64128 Len=0 TSval=1800608952 TSecr=3784845468
     92 29.465552973   192.168.109.136       172.16.30.1           FTP-DATA 1514   FTP Data: 1448 bytes (PASV) (retr )
     93 29.465677081   192.168.109.136       172.16.30.1           FTP-DATA 1514   FTP Data: 1448 bytes (PASV) (retr )
     94 29.465683437   172.16.30.1           192.168.109.136       TCP      66     43196 -> 41585 [ACK] Seq=1 Ack=37649 Win=64128 Len=0 TSval=1800608952 TSecr=3784845469
     95 29.465799583   192.168.109.136       172.16.30.1           FTP-DATA 1514   FTP Data: 1448 bytes (PASV) (retr )
     96 29.465924041   192.168.109.136       172.16.30.1           FTP-DATA 1514   FTP Data: 1448 bytes (PASV) (retr )
     97 29.465930676   172.16.30.1           192.168.109.136       TCP      66     43196 -> 41585 [ACK] Seq=1 Ack=40545 Win=64128 Len=0 TSval=1800608952 TSecr=3784845469
     98 29.466045775   192.168.109.136       172.16.30.1           FTP-DATA 1514   FTP Data: 1448 bytes (PASV) (retr )
     99 29.466169395   192.168.109.136       172.16.30.1           FTP-DATA 1514   FTP Data: 1448 bytes (PASV) (retr )
    100 29.466176938   172.16.30.1           192.168.109.136       TCP      66     43196 -> 41585 [ACK] Seq=1 Ack=43441 Win=64128 Len=0 TSval=1800608952 TSecr=3784845469
    101 29.466291408   192.168.109.136       172.16.30.1           FTP-DATA 1514   FTP Data: 1448 bytes (PASV) (retr )
    102 29.466297903   172.16.30.1           192.168.109.136       TCP      66     43196 -> 41585 [ACK] Seq=1 Ack=44889 Win=67072 Len=0 TSval=1800608953 TSecr=3784845469
    103 29.466414120   192.168.109.136       172.16.30.1           FTP-DATA 1514   FTP Data: 1448 bytes (PASV) (retr )
    104 29.466420545   172.16.30.1           192.168.109.136       TCP      66     43196 -> 41585 [ACK] Seq=1 Ack=46337 Win=69888 Len=0 TSval=1800608953 TSecr=3784845469
    105 29.466537809   192.168.109.136       172.16.30.1           FTP-DATA 1514   FTP Data: 1448 bytes (PASV) (retr )
    106 29.466547797   172.16.30.1           192.168.109.136       TCP      66     43196 -> 41585 [ACK] Seq=1 Ack=47785 Win=72832 Len=0 TSval=1800608953 TSecr=3784845470
    107 29.466661429   192.168.109.136       172.16.30.1           FTP-DATA 1514   FTP Data: 1448 bytes (PASV) (retr )
    108 29.466669042   172.16.30.1           192.168.109.136       TCP      66     43196 -> 41585 [ACK] Seq=1 Ack=49233 Win=75776 Len=0 TSval=1800608953 TSecr=3784845470
    109 29.466783722   192.168.109.136       172.16.30.1           FTP-DATA 1514   FTP Data: 1448 bytes (PASV) (retr )
    110 29.466791055   172.16.30.1           192.168.109.136       TCP      66     43196 -> 41585 [ACK] Seq=1 Ack=50681 Win=78592 Len=0 TSval=1800608953 TSecr=3784845470
    111 29.466907621   192.168.109.136       172.16.30.1           FTP-DATA 1514   FTP Data: 1448 bytes (PASV) (retr )
    112 29.466914116   172.16.30.1           192.168.109.136       TCP      66     43196 -> 41585 [ACK] Seq=1 Ack=52129 Win=81536 Len=0 TSval=1800608953 TSecr=3784845470
    113 29.467031310   192.168.109.136       172.16.30.1           FTP-DATA 1514   FTP Data: 1448 bytes (PASV) (retr )
    114 29.467037596   172.16.30.1           192.168.109.136       TCP      66     43196 -> 41585 [ACK] Seq=1 Ack=53577 Win=84480 Len=0 TSval=1800608953 TSecr=3784845470
    115 29.467154092   192.168.109.136       172.16.30.1           FTP-DATA 1514   FTP Data: 1448 bytes (PASV) (retr )
    116 29.467161774   172.16.30.1           192.168.109.136       TCP      66     43196 -> 41585 [ACK] Seq=1 Ack=55025 Win=87296 Len=0 TSval=1800608953 TSecr=3784845470
    117 29.467275476   192.168.109.136       172.16.30.1           FTP-DATA 1514   FTP Data: 1448 bytes (PASV) (retr )
    118 29.467281972   172.16.30.1           192.168.109.136       TCP      66     43196 -> 41585 [ACK] Seq=1 Ack=56473 Win=90240 Len=0 TSval=1800608954 TSecr=3784845470
    119 29.467399306   192.168.109.136       172.16.30.1           FTP-DATA 1514   FTP Data: 1448 bytes (PASV) (retr )
    120 29.467405801   172.16.30.1           192.168.109.136       TCP      66     43196 -> 41585 [ACK] Seq=1 Ack=57921 Win=93056 Len=0 TSval=1800608954 TSecr=3784845470
    121 29.467522087   192.168.109.136       172.16.30.1           FTP-DATA 1514   FTP Data: 1448 bytes (PASV) (retr )
    122 29.467529630   172.16.30.1           192.168.109.136       TCP      66     43196 -> 41585 [ACK] Seq=1 Ack=59369 Win=96000 Len=0 TSval=1800608954 TSecr=3784845470
    123 29.467644659   192.168.109.136       172.16.30.1           FTP-DATA 1514   FTP Data: 1448 bytes (PASV) (retr )
    124 29.467651085   172.16.30.1           192.168.109.136       TCP      66     43196 -> 41585 [ACK] Seq=1 Ack=60817 Win=98944 Len=0 TSval=1800608954 TSecr=3784845470
    125 29.467768488   192.168.109.136       172.16.30.1           FTP-DATA 1514   FTP Data: 1448 bytes (PASV) (retr )
    126 29.467775542   172.16.30.1           192.168.109.136       TCP      66     43196 -> 41585 [ACK] Seq=1 Ack=62265 Win=101760 Len=0 TSval=1800608954 TSecr=3784845470
    127 29.467892178   192.168.109.136       172.16.30.1           FTP-DATA 1514   FTP Data: 1448 bytes (PASV) (retr )
    128 29.467899511   172.16.30.1           192.168.109.136       TCP      66     43196 -> 41585 [ACK] Seq=1 Ack=63713 Win=104704 Len=0 TSval=1800608954 TSecr=3784845470
    129 29.468013982   192.168.109.136       172.16.30.1           FTP-DATA 1514   FTP Data: 1448 bytes (PASV) (retr )
    130 29.468020756   172.16.30.1           192.168.109.136       TCP      66     43196 -> 41585 [ACK] Seq=1 Ack=65161 Win=107648 Len=0 TSval=1800608954 TSecr=3784845470
    131 29.468136274   192.168.109.136       172.16.30.1           FTP-DATA 1514   FTP Data: 1448 bytes (PASV) (retr )
    132 29.468142839   172.16.30.1           192.168.109.136       TCP      66     43196 -> 41585 [ACK] Seq=1 Ack=66609 Win=110464 Len=0 TSval=1800608954 TSecr=3784845470
    133 29.468260034   192.168.109.136       172.16.30.1           FTP-DATA 1514   FTP Data: 1448 bytes (PASV) (retr )
    134 29.468267367   172.16.30.1           192.168.109.136       TCP      66     43196 -> 41585 [ACK] Seq=1 Ack=68057 Win=113408 Len=0 TSval=1800608955 TSecr=3784845471
    135 29.468382955   192.168.109.136       172.16.30.1           FTP-DATA 1514   FTP Data: 1448 bytes (PASV) (retr )
    136 29.468389520   172.16.30.1           192.168.109.136       TCP      66     43196 -> 41585 [ACK] Seq=1 Ack=69505 Win=116224 Len=0 TSval=1800608955 TSecr=3784845471
    137 29.468506016   192.168.109.136       172.16.30.1           FTP-DATA 1514   FTP Data: 1448 bytes (PASV) (retr )
    138 29.468513419   172.16.30.1           192.168.109.136       TCP      66     43196 -> 41585 [ACK] Seq=1 Ack=70953 Win=119168 Len=0 TSval=1800608955 TSecr=3784845471
    139 29.468631242   192.168.109.136       172.16.30.1           FTP-DATA 1514   FTP Data: 1448 bytes (PASV) (retr )
    140 29.468638924   172.16.30.1           192.168.109.136       TCP      66     43196 -> 41585 [ACK] Seq=1 Ack=72401 Win=122112 Len=0 TSval=1800608955 TSecr=3784845471
    141 29.468751788   192.168.109.136       172.16.30.1           FTP-DATA 1514   FTP Data: 1448 bytes (PASV) (retr )
    142 29.468758004   172.16.30.1           192.168.109.136       TCP      66     43196 -> 41585 [ACK] Seq=1 Ack=73849 Win=124928 Len=0 TSval=1800608955 TSecr=3784845471
    143 29.468874640   192.168.109.136       172.16.30.1           FTP-DATA 1514   FTP Data: 1448 bytes (PASV) (retr )
    144 29.468880925   172.16.30.1           192.168.109.136       TCP      66     43196 -> 41585 [ACK] Seq=1 Ack=75297 Win=127872 Len=0 TSval=1800608955 TSecr=3784845471
    145 29.468998399   192.168.109.136       172.16.30.1           FTP-DATA 1514   FTP Data: 1448 bytes (PASV) (retr )
    146 29.469004266   172.16.30.1           192.168.109.136       TCP      66     43196 -> 41585 [ACK] Seq=1 Ack=76745 Win=130816 Len=0 TSval=1800608955 TSecr=3784845472
    147 29.469120831   192.168.109.136       172.16.30.1           FTP-DATA 1514   FTP Data: 1448 bytes (PASV) (retr )
    148 29.469126977   172.16.30.1           192.168.109.136       TCP      66     43196 -> 41585 [ACK] Seq=1 Ack=78193 Win=133632 Len=0 TSval=1800608955 TSecr=3784845472
    149 29.469243683   192.168.109.136       172.16.30.1           FTP-DATA 1514   FTP Data: 1448 bytes (PASV) (retr )
    150 29.469249410   172.16.30.1           192.168.109.136       TCP      66     43196 -> 41585 [ACK] Seq=1 Ack=79641 Win=136576 Len=0 TSval=1800608956 TSecr=3784845472
...
    399 29.484624063   192.168.109.136       172.16.30.1           FTP-DATA 1514   FTP Data: 1448 bytes (PASV) (retr )
    400 29.484630279   172.16.30.1           192.168.109.136       TCP      66     43196 -> 41585 [ACK] Seq=1 Ack=260641 Win=498560 Len=0 TSval=1800608971 TSecr=3784845487
    401 29.484746774   192.168.109.136       172.16.30.1           FTP-DATA 1514   FTP Data: 1448 bytes (PASV) (retr )
    402 29.484752432   172.16.30.1           192.168.109.136       TCP      66     43196 -> 41585 [ACK] Seq=1 Ack=262089 Win=501504 Len=0 TSval=1800608971 TSecr=3784845487
    403 29.484870464   192.168.109.136       172.16.30.1           FTP-DATA 1514   FTP Data: 1448 bytes (PASV) (retr )
    404 29.484876121   172.16.30.1           192.168.109.136       TCP      66     43196 -> 41585 [ACK] Seq=1 Ack=263537 Win=504320 Len=0 TSval=1800608971 TSecr=3784845487
    405 29.484993036   192.168.109.136       172.16.30.1           FTP-DATA 1514   FTP Data: 1448 bytes (PASV) (retr )
    406 29.484998763   172.16.30.1           192.168.109.136       TCP      66     43196 -> 41585 [ACK] Seq=1 Ack=264985 Win=507264 Len=0 TSval=1800608971 TSecr=3784845487
    407 29.485116167   192.168.109.136       172.16.30.1           FTP-DATA 1514   FTP Data: 1448 bytes (PASV) (retr )
    408 29.485121964   172.16.30.1           192.168.109.136       TCP      66     43196 -> 41585 [ACK] Seq=1 Ack=266433 Win=510080 Len=0 TSval=1800608971 TSecr=3784845487
    409 29.485239717   192.168.109.136       172.16.30.1           FTP-DATA 1514   FTP Data: 1448 bytes (PASV) (retr )
    410 29.485245513   172.16.30.1           192.168.109.136       TCP      66     43196 -> 41585 [ACK] Seq=1 Ack=267881 Win=513024 Len=0 TSval=1800608972 TSecr=3784845487
    411 29.485362708   192.168.109.136       172.16.30.1           FTP-DATA 1514   FTP Data: 1448 bytes (PASV) (retr )
    412 29.485368435   172.16.30.1           192.168.109.136       TCP      66     43196 -> 41585 [ACK] Seq=1 Ack=269329 Win=515968 Len=0 TSval=1800608972 TSecr=3784845487
    413 29.485485140   192.168.109.136       172.16.30.1           FTP-DATA 1514   FTP Data: 1448 bytes (PASV) (retr )
    414 29.485490937   172.16.30.1           192.168.109.136       TCP      66     43196 -> 41585 [ACK] Seq=1 Ack=270777 Win=518784 Len=0 TSval=1800608972 TSecr=3784845487
    415 29.485608341   192.168.109.136       172.16.30.1           FTP-DATA 1514   FTP Data: 1448 bytes (PASV) (retr )
    416 29.485614137   172.16.30.1           192.168.109.136       TCP      66     43196 -> 41585 [ACK] Seq=1 Ack=272225 Win=521728 Len=0 TSval=1800608972 TSecr=3784845487
    417 29.485731681   192.168.109.136       172.16.30.1           FTP-DATA 1514   FTP Data: 1448 bytes (PASV) (retr )
    418 29.485737338   172.16.30.1           192.168.109.136       TCP      66     43196 -> 41585 [ACK] Seq=1 Ack=273673 Win=524672 Len=0 TSval=1800608972 TSecr=3784845488
    419 29.485854323   192.168.109.136       172.16.30.1           FTP-DATA 1514   FTP Data: 1448 bytes (PASV) (retr )
    420 29.485860329   172.16.30.1           192.168.109.136       TCP      66     43196 -> 41585 [ACK] Seq=1 Ack=275121 Win=525824 Len=0 TSval=1800608972 TSecr=3784845488
    421 29.485977034   192.168.109.136       172.16.30.1           FTP-DATA 1514   FTP Data: 1448 bytes (PASV) (retr )
    422 29.486102260   192.168.109.136       172.16.30.1           FTP-DATA 1514   FTP Data: 1448 bytes (PASV) (retr )
    423 29.486108895   172.16.30.1           192.168.109.136       TCP      66     43196 -> 41585 [ACK] Seq=1 Ack=278017 Win=525824 Len=0 TSval=1800608972 TSecr=3784845488
    424 29.486223855   192.168.109.136       172.16.30.1           FTP-DATA 1514   FTP Data: 1448 bytes (PASV) (retr )
    425 29.486346566   192.168.109.136       172.16.30.1           FTP-DATA 1514   FTP Data: 1448 bytes (PASV) (retr )
    426 29.486352433   172.16.30.1           192.168.109.136       TCP      66     43196 -> 41585 [ACK] Seq=1 Ack=280913 Win=525824 Len=0 TSval=1800608973 TSecr=3784845488
    427 29.486470046   192.168.109.136       172.16.30.1           FTP-DATA 1514   FTP Data: 1448 bytes (PASV) (retr )
    428 29.486593037   192.168.109.136       172.16.30.1           FTP-DATA 1514   FTP Data: 1448 bytes (PASV) (retr )
    429 29.486598276   172.16.30.1           192.168.109.136       TCP      66     43196 -> 41585 [ACK] Seq=1 Ack=283809 Win=525824 Len=0 TSval=1800608973 TSecr=3784845488
    430 29.486715330   192.168.109.136       172.16.30.1           FTP-DATA 1514   FTP Data: 1448 bytes (PASV) (retr )
    431 29.486839439   192.168.109.136       172.16.30.1           FTP-DATA 1514   FTP Data: 1448 bytes (PASV) (retr )
    432 29.486844886   172.16.30.1           192.168.109.136       TCP      66     43196 -> 41585 [ACK] Seq=1 Ack=286705 Win=525824 Len=0 TSval=1800608973 TSecr=3784845488
    433 29.486961871   192.168.109.136       172.16.30.1           FTP-DATA 1514   FTP Data: 1448 bytes (PASV) (retr )
    434 29.487084932   192.168.109.136       172.16.30.1           FTP-DATA 1514   FTP Data: 1448 bytes (PASV) (retr )
    435 29.487090380   172.16.30.1           192.168.109.136       TCP      66     43196 -> 41585 [ACK] Seq=1 Ack=289601 Win=525824 Len=0 TSval=1800608973 TSecr=3784845489
    436 29.487207364   192.168.109.136       172.16.30.1           FTP-DATA 1514   FTP Data: 1448 bytes (PASV) (retr )
    437 29.487331263   192.168.109.136       172.16.30.1           FTP-DATA 1514   FTP Data: 1448 bytes (PASV) (retr )
    438 29.487336641   172.16.30.1           192.168.109.136       TCP      66     43196 -> 41585 [ACK] Seq=1 Ack=292497 Win=525824 Len=0 TSval=1800608974 TSecr=3784845489
    439 29.487453905   192.168.109.136       172.16.30.1           FTP-DATA 1514   FTP Data: 1448 bytes (PASV) (retr )
    440 29.487577245   192.168.109.136       172.16.30.1           FTP-DATA 1514   FTP Data: 1448 bytes (PASV) (retr )
    441 29.487582972   172.16.30.1           192.168.109.136       TCP      66     43196 -> 41585 [ACK] Seq=1 Ack=295393 Win=525824 Len=0 TSval=1800608974 TSecr=3784845489
    442 29.487700376   192.168.109.136       172.16.30.1           FTP-DATA 1514   FTP Data: 1448 bytes (PASV) (retr )
    443 29.487823228   192.168.109.136       172.16.30.1           FTP-DATA 1514   FTP Data: 1448 bytes (PASV) (retr )
    444 29.487828745   172.16.30.1           192.168.109.136       TCP      66     43196 -> 41585 [ACK] Seq=1 Ack=298289 Win=525824 Len=0 TSval=1800608974 TSecr=3784845490
    445 29.487945730   192.168.109.136       172.16.30.1           FTP-DATA 1514   FTP Data: 1448 bytes (PASV) (retr )
    446 29.488069699   192.168.109.136       172.16.30.1           FTP-DATA 1514   FTP Data: 1448 bytes (PASV) (retr )
    447 29.488075146   172.16.30.1           192.168.109.136       TCP      66     43196 -> 41585 [ACK] Seq=1 Ack=301185 Win=525824 Len=0 TSval=1800608974 TSecr=3784845490
    448 29.488192201   192.168.109.136       172.16.30.1           FTP-DATA 1514   FTP Data: 1448 bytes (PASV) (retr )
    449 29.488315122   192.168.109.136       172.16.30.1           FTP-DATA 1514   FTP Data: 1448 bytes (PASV) (retr )
    450 29.488320570   172.16.30.1           192.168.109.136       TCP      66     43196 -> 41585 [ACK] Seq=1 Ack=304081 Win=525824 Len=0 TSval=1800608975 TSecr=3784845490
...
   2099 29.624889694   192.168.109.136       172.16.30.1           FTP-DATA 1514   FTP Data: 1448 bytes (PASV) (retr )
   2100 29.625013733   192.168.109.136       172.16.30.1           FTP-DATA 1514   FTP Data: 1448 bytes (PASV) (retr )
   2101 29.625019110   172.16.30.1           192.168.109.136       TCP      66     43196 -> 41585 [ACK] Seq=1 Ack=1912809 Win=525824 Len=0 TSval=1800609111 TSecr=3784845620
   2102 29.625136374   192.168.109.136       172.16.30.1           FTP-DATA 1514   FTP Data: 1448 bytes (PASV) (retr )
   2103 29.625258946   192.168.109.136       172.16.30.1           FTP-DATA 1514   FTP Data: 1448 bytes (PASV) (retr )
   2104 29.625264534   172.16.30.1           192.168.109.136       TCP      66     43196 -> 41585 [ACK] Seq=1 Ack=1915705 Win=525824 Len=0 TSval=1800609112 TSecr=3784845620
   2105 29.625383404   192.168.109.136       172.16.30.1           FTP-DATA 1514   FTP Data: 1448 bytes (PASV) (retr )
   2106 29.625505767   192.168.109.136       172.16.30.1           FTP-DATA 1514   FTP Data: 1448 bytes (PASV) (retr )
   2107 29.625511424   172.16.30.1           192.168.109.136       TCP      66     43196 -> 41585 [ACK] Seq=1 Ack=1918601 Win=525824 Len=0 TSval=1800609112 TSecr=3784845622
   2108 29.625628129   192.168.109.136       172.16.30.1           FTP-DATA 1514   FTP Data: 1448 bytes (PASV) (retr )
   2109 29.625752028   192.168.109.136       172.16.30.1           FTP-DATA 1514   FTP Data: 1448 bytes (PASV) (retr )
   2110 29.625757406   172.16.30.1           192.168.109.136       TCP      66     43196 -> 41585 [ACK] Seq=1 Ack=1921497 Win=525824 Len=0 TSval=1800609112 TSecr=3784845622
   2111 29.625874600   192.168.109.136       172.16.30.1           FTP-DATA 1514   FTP Data: 1448 bytes (PASV) (retr )
   2112 29.625997452   192.168.109.136       172.16.30.1           FTP-DATA 1514   FTP Data: 1448 bytes (PASV) (retr )
   2113 29.626002899   172.16.30.1           192.168.109.136       TCP      66     43196 -> 41585 [ACK] Seq=1 Ack=1924393 Win=525824 Len=0 TSval=1800609112 TSecr=3784845622
   2114 29.626121840   192.168.109.136       172.16.30.1           FTP-DATA 1514   FTP Data: 1448 bytes (PASV) (retr )
   2115 29.626244132   192.168.109.136       172.16.30.1           FTP-DATA 1514   FTP Data: 1448 bytes (PASV) (retr )
   2116 29.626250069   172.16.30.1           192.168.109.136       TCP      66     43196 -> 41585 [ACK] Seq=1 Ack=1927289 Win=525824 Len=0 TSval=1800609113 TSecr=3784845622
   2117 29.626366774   192.168.109.136       172.16.30.1           FTP-DATA 1514   FTP Data: 1448 bytes (PASV) (retr )
   2118 29.626489346   192.168.109.136       172.16.30.1           FTP-DATA 1514   FTP Data: 1448 bytes (PASV) (retr )
   2119 29.626495143   172.16.30.1           192.168.109.136       TCP      66     43196 -> 41585 [ACK] Seq=1 Ack=1930185 Win=525824 Len=0 TSval=1800609113 TSecr=3784845622
   2120 29.626612966   192.168.109.136       172.16.30.1           FTP-DATA 1514   FTP Data: 1448 bytes (PASV) (retr )
   2121 29.626735887   192.168.109.136       172.16.30.1           FTP-DATA 1514   FTP Data: 1448 bytes (PASV) (retr )
   2122 29.626741684   172.16.30.1           192.168.109.136       TCP      66     43196 -> 41585 [ACK] Seq=1 Ack=1933081 Win=525824 Len=0 TSval=1800609113 TSecr=3784845623
   2123 29.626858529   192.168.109.136       172.16.30.1           FTP-DATA 1514   FTP Data: 1448 bytes (PASV) (retr )
   2124 29.626982428   192.168.109.136       172.16.30.1           FTP-DATA 1514   FTP Data: 1448 bytes (PASV) (retr )
   2125 29.626988364   172.16.30.1           192.168.109.136       TCP      66     43196 -> 41585 [ACK] Seq=1 Ack=1935977 Win=525824 Len=0 TSval=1800609113 TSecr=3784845623
   2126 29.627104930   192.168.109.136       172.16.30.1           FTP-DATA 1514   FTP Data: 1448 bytes (PASV) (retr )
   2127 29.627227921   192.168.109.136       172.16.30.1           FTP-DATA 1514   FTP Data: 1448 bytes (PASV) (retr )
   2128 29.627233369   172.16.30.1           192.168.109.136       TCP      66     43196 -> 41585 [ACK] Seq=1 Ack=1938873 Win=525824 Len=0 TSval=1800609114 TSecr=3784845623
   2129 29.627352100   192.168.109.136       172.16.30.1           FTP-DATA 1514   FTP Data: 1448 bytes (PASV) (retr )
   2130 29.627474462   192.168.109.136       172.16.30.1           FTP-DATA 1514   FTP Data: 1448 bytes (PASV) (retr )
   2131 29.627480189   172.16.30.1           192.168.109.136       TCP      66     43196 -> 41585 [ACK] Seq=1 Ack=1941769 Win=525824 Len=0 TSval=1800609114 TSecr=3784845623
   2132 29.627596825   192.168.109.136       172.16.30.1           FTP-DATA 1514   FTP Data: 1448 bytes (PASV) (retr )
   2133 29.627720654   192.168.109.136       172.16.30.1           FTP-DATA 1514   FTP Data: 1448 bytes (PASV) (retr )
   2134 29.627726171   172.16.30.1           192.168.109.136       TCP      66     43196 -> 41585 [ACK] Seq=1 Ack=1944665 Win=525824 Len=0 TSval=1800609114 TSecr=3784845623
   2135 29.627843296   192.168.109.136       172.16.30.1           FTP-DATA 1514   FTP Data: 1448 bytes (PASV) (retr )
   2136 29.627966217   192.168.109.136       172.16.30.1           FTP-DATA 1514   FTP Data: 1448 bytes (PASV) (retr )
   2137 29.627971804   172.16.30.1           192.168.109.136       TCP      66     43196 -> 41585 [ACK] Seq=1 Ack=1947561 Win=525824 Len=0 TSval=1800609114 TSecr=3784845624
   2138 29.628089767   192.168.109.136       172.16.30.1           FTP-DATA 1514   FTP Data: 1448 bytes (PASV) (retr )
   2139 29.628212688   192.168.109.136       172.16.30.1           FTP-DATA 1514   FTP Data: 1448 bytes (PASV) (retr )
   2140 29.628218555   172.16.30.1           192.168.109.136       TCP      66     43196 -> 41585 [ACK] Seq=1 Ack=1950457 Win=525824 Len=0 TSval=1800609115 TSecr=3784845624
   2141 29.628335400   192.168.109.136       172.16.30.1           FTP-DATA 1514   FTP Data: 1448 bytes (PASV) (retr )
   2142 29.628458810   192.168.109.136       172.16.30.1           FTP-DATA 1514   FTP Data: 1448 bytes (PASV) (retr )
   2143 29.628464397   172.16.30.1           192.168.109.136       TCP      66     43196 -> 41585 [ACK] Seq=1 Ack=1953353 Win=525824 Len=0 TSval=1800609115 TSecr=3784845624
   2144 29.628581731   192.168.109.136       172.16.30.1           FTP-DATA 1514   FTP Data: 1448 bytes (PASV) (retr )
   2145 29.628704652   192.168.109.136       172.16.30.1           FTP-DATA 1514   FTP Data: 1448 bytes (PASV) (retr )
   2146 29.628710379   172.16.30.1           192.168.109.136       TCP      66     43196 -> 41585 [ACK] Seq=1 Ack=1956249 Win=525824 Len=0 TSval=1800609115 TSecr=3784845624
   2147 29.628827224   192.168.109.136       172.16.30.1           FTP-DATA 1514   FTP Data: 1448 bytes (PASV) (retr )
   2148 29.628950984   192.168.109.136       172.16.30.1           FTP-DATA 1514   FTP Data: 1448 bytes (PASV) (retr )
   2149 29.628956431   172.16.30.1           192.168.109.136       TCP      66     43196 -> 41585 [ACK] Seq=1 Ack=1959145 Win=525824 Len=0 TSval=1800609115 TSecr=3784845624
   2150 29.629073556   192.168.109.136       172.16.30.1           FTP-DATA 1514   FTP Data: 1448 bytes (PASV) (retr )
   2151 29.629196617   192.168.109.136       172.16.30.1           FTP-DATA 1514   FTP Data: 1448 bytes (PASV) (retr )
   2152 29.629202064   172.16.30.1           192.168.109.136       TCP      66     43196 -> 41585 [ACK] Seq=1 Ack=1962041 Win=525824 Len=0 TSval=1800609116 TSecr=3784845624
   2153 29.629321074   192.168.109.136       172.16.30.1           FTP-DATA 1514   FTP Data: 1448 bytes (PASV) (retr )
   2154 29.629443437   192.168.109.136       172.16.30.1           FTP-DATA 1514   FTP Data: 1448 bytes (PASV) (retr )
   2155 29.629449862   172.16.30.1           192.168.109.136       TCP      66     43196 -> 41585 [ACK] Seq=1 Ack=1964937 Win=525824 Len=0 TSval=1800609116 TSecr=3784845624
   2156 29.629502872   192.168.109.136       172.16.30.1           FTP-DATA 761    FTP Data: 695 bytes (PASV) (retr )
   2157 29.670099286   172.16.30.1           192.168.109.136       TCP      66     43196 -> 41585 [ACK] Seq=1 Ack=1965633 Win=525824 Len=0 TSval=1800609156 TSecr=3784845624
   2158 29.671341000   192.168.109.136       172.16.30.1           FTP      90     Response: 226 Transfer complete.
   2159 29.671350988   172.16.30.1           192.168.109.136       TCP      66     46772 -> 21 [ACK] Seq=46 Ack=247 Win=64256 Len=0 TSval=1800609158 TSecr=3784845675
   2160 29.671371940   172.16.30.1           192.168.109.136       FTP      70     Request: quit
   2161 29.672418866   192.168.109.136       172.16.30.1           TCP      66     21 -> 46772 [ACK] Seq=247 Ack=50 Win=65280 Len=0 TSval=3784845676 TSecr=1800609158
   2162 29.672427177   172.16.30.1           192.168.109.136       FTP      67     Request: 
   2163 29.673479899   192.168.109.136       172.16.30.1           TCP      66     21 -> 46772 [ACK] Seq=247 Ack=51 Win=65280 Len=0 TSval=3784845677 TSecr=1800609159
   2164 29.673536890   192.168.109.136       172.16.30.1           FTP      80     Response: 221 Goodbye.
   2165 29.673559589   172.16.30.1           192.168.109.136       TCP      66     46772 -> 21 [FIN, ACK] Seq=51 Ack=261 Win=64256 Len=0 TSval=1800609160 TSecr=3784845677
   2166 29.673579284   172.16.30.1           192.168.109.136       TCP      66     43196 -> 41585 [FIN, ACK] Seq=1 Ack=1965633 Win=525824 Len=0 TSval=1800609160 TSecr=3784845624
   2167 29.673585221   192.168.109.136       172.16.30.1           TCP      66     21 -> 46772 [FIN, ACK] Seq=261 Ack=51 Win=65280 Len=0 TSval=3784845677 TSecr=1800609159
   2168 29.673591227   172.16.30.1           192.168.109.136       TCP      66     46772 -> 21 [ACK] Seq=52 Ack=262 Win=64256 Len=0 TSval=1800609160 TSecr=3784845677
   2169 29.674552387   192.168.109.136       172.16.30.1           TCP      66     41585 -> 43196 [ACK] Seq=1965633 Ack=2 Win=65280 Len=0 TSval=3784845678 TSecr=1800609160
   2170 29.674655962   192.168.109.136       172.16.30.1           TCP      66     21 -> 46772 [ACK] Seq=262 Ack=52 Win=65280 Len=0 TSval=3784845678 TSecr=1800609160
   2171 30.073434520   Cisco_3a:fa:83        Spanning-tree-(for-bridges)_00 STP      60     Conf. Root = 32768/30/fc:fb:fb:3a:fa:80  Cost = 0  Port = 0x8003
   2172 32.073183526   Cisco_3a:fa:83        Spanning-tree-(for-bridges)_00 STP      60     Conf. Root = 32768/30/fc:fb:fb:3a:fa:80  Cost = 0  Port = 0x8003
   2173 34.078061421   Cisco_3a:fa:83        Spanning-tree-(for-bridges)_00 STP      60     Conf. Root = 32768/30/fc:fb:fb:3a:fa:80  Cost = 0  Port = 0x8003
   2174 34.676522243   HewlettP_5a:7d:74     HewlettP_61:24:92     ARP      60     Who has 172.16.30.1? Tell 172.16.30.254
   2175 34.676543754   HewlettP_61:24:92     HewlettP_5a:7d:74     ARP      42     172.16.30.1 is at 00:21:5a:61:24:92
   2176 36.087963582   Cisco_3a:fa:83        Spanning-tree-(for-bridges)_00 STP      60     Conf. Root = 32768/30/fc:fb:fb:3a:fa:80  Cost = 0  Port = 0x8003
   2177 36.343046028   Cisco_3a:fa:83        Cisco_3a:fa:83        LOOP     60     Reply
   2178 38.087913313   Cisco_3a:fa:83        Spanning-tree-(for-bridges)_00 STP      60     Conf. Root = 32768/30/fc:fb:fb:3a:fa:80  Cost = 0  Port = 0x8003
